{
  "id": "793ecbc22b51a2c3",
  "title": "البنك الأهلى المصرى - حسابات التوفير",
  "url": "https://www.nbe.com.eg/NBE/E/#/AR/ProductCategory?inParams=%7B%22CategoryID%22%3A%22Saving%20Accounts%22%7D",
  "language": "ar",
  "content": "أفراد\n\nالشركات\n\nالمشروعات الصغيرة\n\nبلاتينم\n\nNab Bar Menu\n\nChange Language\n\nالوظائف\n\nSearch Bar\n\nNBE logo\n\nMega Menu\n\nالحسابات\n\nحسابات التوفير\n\nCatagory landing div\n\nحسابات التوفير - عملة محلية\n\nسهولة السحب و الايداع و التمتع بعائد دوري علي مدخراتك\n\nحسابات التوفير- عملة أجنبية\n\nسهولة السحب والايداع مع العائد وإمكانية فتح الحساب بالدولار الأمريكي ، الجنيه الإسترليني ، اليورو\n\n#CategoryMiddleContainer#\n\n#ProductShortLayoutContainer#\n\nاظغط للمقارنة بين المنتجات.\n\n#CategoryFooterContainer#\n\nSiteMap\n\n1187 كورنيش النيل ، برج البنك الأهلي ، بولاق ، القاهرة ، مصر\n\nمحليا: 19623 - دوليا: 0020219623 / 0020225941200\n\nاتصل بنا على الفور على الخط الساخن على مدار 24-ساعة 19623 للإبلاغ عن مشكلة أو بطاقة مفقودة\n\nCopyrights\n\nFloating Banner\n\nهذه الرسالة تحتوي على بيانات شخصية أو مالية. لذلك, لن يتم تنفيذ طلبك.\n\nبرجاء عدم الإفصاح عن بياناتك الشخصية أو المالية أثناء استخدام الخدمة.\n\nThis message contains personal or financial information.\n\nTherefore, your request cannot be processes here.\n\nPlease do not disclose your personal or financial data when using this service.\n\nConfirm\n\nبرجاء العلم أن الخدمة للاستعلام فقط عن المنتجات والخدمات المقدمة من البنك للعملاء الأفراد والشركات.\n\nمرحبا، 👋\n\nدعنا نتحدث إذا كان لديك أي أسئلة",
  "metadata": {
    "content_hash": "8c6eaeec9f2f664e641316f1089f268edf9b9303b57e627e40a1b9d923cba25b",
    "extracted_at": "2026-07-14T08:39:39.841924+00:00",
    "has_tables": false,
    "source": "playwright_rescrape",
    "error": null
  }
}