{
  "id": "59cc5bb80678f31d",
  "title": "البنك الأهلى المصرى - وورلد إيليت",
  "url": "https://www.nbe.com.eg/NBE/E/#/AR/ProductDetails?inParams=%7B%22CategoryID%22%3A%22DepitCardsID%22%2C%22ProductID%22%3A%22%D9%88%D9%88%D8%B1%D9%84%D8%AF%20%D8%A5%D9%8A%D9%84%D9%8A%D8%AA_18689%22%7D",
  "language": "ar",
  "content": "أفراد\n\nالشركات\n\nالمشروعات الصغيرة\n\nبلاتينم\n\nNab Bar Menu\n\nChange Language\n\nالوظائف\n\nSearch Bar\n\nNBE logo\n\nMega Menu\n\nالبطاقات\n\nبطاقات الخصم المباشر\n\nوورلد إيليت\n\n#ProductHeaderContainer#\n\nمميزات البطاقة\n\n5 سنوات\n\nمحليا\n\nمتاح\n\nالبطاقة مصممة لعملاء البنك من الأفراد الطبيعيين،  ذوي الملاءة المالية التي تبلغ أرصدتهم أكثر من 20 مليون جنيه مصري (أو ما يعادلها بالعملات الأجنبية)\n\nالإدراج التلقائي ببرنامج Al Ahly Points  الذي يتيح لكم الحصول على (1.50 نقطة) على كل جنيه مصري يتم استخدامه في المشتريات.\n\nاستبدل نقاطك من خلال\n\n#ProductTypeMiddleContainer#\n\nمميزات \nبطاقات الخصم المباشر\n\nالمرونة\n\nاستخدام البطاقة محليا في المشتريات والسحب النقدى.\n\nالامان\n\nالتسوق الامن عبر الأنترنت من خلال خدمة الكود الامن للشراء (OTP)\n\n24/7 الأهلي فون\n\nنتشرف بخدمتكم واجابة جميع استفساراتكم من خلال خدمة\nالأهلي فون 19523 محليا و 0020225941200 دوليا\n\n#CategoryFooterContainer#\n\nOthers Products\n\n#ProductOtherLayoutContainer#\n\nTo compare between products press...\n\n#ProductTypeFooterContainer#\n\n#ProductFooterContainer#\n\nهذه الصفحه غير متاحة\n\nSiteMap\n\n1187 كورنيش النيل ، برج البنك الأهلي ، بولاق ، القاهرة ، مصر\n\nمحليا: 19623 - دوليا: 0020219623 / 0020225941200\n\nاتصل بنا على الفور على الخط الساخن على مدار 24-ساعة 19623 للإبلاغ عن مشكلة أو بطاقة مفقودة\n\nCopyrights\n\nFloating Banner\n\nهذه الرسالة تحتوي على بيانات شخصية أو مالية. لذلك, لن يتم تنفيذ طلبك.\n\nبرجاء عدم الإفصاح عن بياناتك الشخصية أو المالية أثناء استخدام الخدمة.\n\nThis message contains personal or financial information.\n\nTherefore, your request cannot be processes here.\n\nPlease do not disclose your personal or financial data when using this service.\n\nConfirm\n\nبرجاء العلم أن الخدمة للاستعلام فقط عن المنتجات والخدمات المقدمة من البنك للعملاء الأفراد والشركات.\n\nمرحبا، 👋\n\nدعنا نتحدث إذا كان لديك أي أسئلة",
  "metadata": {
    "content_hash": "6171ed0f1fc4aa833345a1b04ac5bb7d72d57dcc93fb02947c66711fe7f42d66",
    "extracted_at": "2026-07-14T08:40:46.191823+00:00",
    "has_tables": false,
    "source": "playwright_rescrape",
    "error": null
  }
}