{
  "id": "c09c14c04b7fe90c",
  "title": "البنك الأهلى المصرى - شهادة استثمار ' ب '",
  "url": "https://www.nbe.com.eg/NBE/E/#/AR/ProductDetails?inParams=%7B%22CategoryID%22%3A%22InvestmentCertificateCatID%22%2C%22ProductID%22%3A%22%D8%B4%D9%87%D8%A7%D8%AF%D8%A9%20%D8%A7%D8%B3%D8%AA%D8%AB%D9%85%D8%A7%D8%B1%20'%20%D8%A8%20'_6348%22%7D",
  "language": "ar",
  "content": "أفراد\n\nالشركات\n\nالمشروعات الصغيرة\n\nبلاتينم\n\nNab Bar Menu\n\nChange Language\n\nالوظائف\n\nSearch Bar\n\nNBE logo\n\nMega Menu\n\nشهادات الادخار\n\nشهادات الاستثمار\n\nشهادة استثمار ' ب '\n\n#ProductHeaderContainer#\n\nفئات الشهادة\n\n500\n\nجم\n\nومضاعفاتها\n\nالمدة\n\nسنة\n\nدورية صرف العائد\n\nشهري\n\nسعر العائد\n\n14%\n\nمن يحق لهم الشراء\n\nتصدر الشهادات للأشخاص الطبيعيين المصريين والأجانب بالغين و قصر\n\nالاقتراض\n\nيجوز الاقتراض بضمان هذه الشهادات من أي من فروع مصرفنا وفقاً والتعليمات السارية و اسعار العوائد في تاريخ الاقتراض\n\nألاسترداد\n\nتسترد الشهادة في نهاية المدة بكامل قيمتها الاسمية , ويمكن استردادها بعد مضي ستة اشهر من يوم العمل التالي ليوم الشراء وفقا و القيم الاستردادية المعدة في هذا الشان.\n\nمميزات أخري\n\nيتم صرف العائد من خلال ماكينات الصرف الالى المنتشرة في جميع أنحاء الجمهورية خلال أيام الأسبوع وعلى مدار 24 ساعة\n\nمدة الشهادة سنة واحدة تبدأ من يوم العمل التالي لتاريخ الشراء و تجدد تلقائيا في تاريخ أستحقاقها ما لم يتم أستردادها أو وجود تعليمات بخلاف ذلك.\n\nتدر الشهادات عائد دوري شهري بسعر عائد ثابت طوال مدة الشهادة يحدد وفقا للسعر السائد في تاريخ اصدار الشهادات  و يحتسب اعتبارا من يوم العمل التالي لتاريخ الشراء, و يصرف في تاريخ استحقاقه.\n\n#ProductTypeMiddleContainer#\n\n#ProductMiddleContainer#\n\nمنتجات اخرى\n\nشهادة استثمار ' أ '\n\n10\n\nشهادة استثمار 'ج '\n\n20\n\nللمقارنة بين المنتجات إضغط ...\n\n#ProductTypeFooterContainer#\n\n#ProductFooterContainer#\n\nهذه الصفحه غير متاحة\n\nSiteMap\n\n1187 كورنيش النيل ، برج البنك الأهلي ، بولاق ، القاهرة ، مصر\n\nمحليا: 19623 - دوليا: 0020219623 / 0020225941200\n\nاتصل بنا على الفور على الخط الساخن على مدار 24-ساعة 19623 للإبلاغ عن مشكلة أو بطاقة مفقودة\n\nCopyrights\n\nFloating Banner\n\nهذه الرسالة تحتوي على بيانات شخصية أو مالية. لذلك, لن يتم تنفيذ طلبك.\n\nبرجاء عدم الإفصاح عن بياناتك الشخصية أو المالية أثناء استخدام الخدمة.\n\nThis message contains personal or financial information.\n\nTherefore, your request cannot be processes here.\n\nPlease do not disclose your personal or financial data when using this service.\n\nConfirm\n\nبرجاء العلم أن الخدمة للاستعلام فقط عن المنتجات والخدمات المقدمة من البنك للعملاء الأفراد والشركات.\n\nمرحبا، 👋\n\nدعنا نتحدث إذا كان لديك أي أسئلة",
  "metadata": {
    "content_hash": "baf9f014f0dadc43181931276506f7ebf81eaa65a16b6d04c5f79f8b78538859",
    "extracted_at": "2026-07-14T08:39:25.369295+00:00",
    "has_tables": false,
    "source": "playwright_rescrape",
    "error": null
  }
}