{
  "id": "a60ce530d4ae3d07",
  "title": "البنك الأهلى المصرى - حساب توفير المستقبل",
  "url": "https://www.nbe.com.eg/NBE/E/#/AR/ProductDetails?inParams=%7B%22CategoryID%22%3A%22OpenYourBankAccountInEgypt%22%2C%22ProductID%22%3A%22%D8%AD%D8%B3%D8%A7%D8%A8%20%D8%AA%D9%88%D9%81%D9%8A%D8%B1%20%D8%A7%D9%84%D9%85%D8%B3%D8%AA%D9%82%D8%A8%D9%84_6353%22%7D",
  "language": "ar",
  "content": "أفراد\n\nالشركات\n\nالمشروعات الصغيرة\n\nبلاتينم\n\nNab Bar Menu\n\nChange Language\n\nالوظائف\n\nSearch Bar\n\nNBE logo\n\nMega Menu\n\nالحسابات\n\nمبادرة افتح حسابك في مصر\n\nحساب توفير المستقبل\n\n#ProductHeaderContainer#\n\nالخصائص\n\nبدون حد ادني لفتح الحساب\n\n3001\n\nسعر العائد\n\nالشهري يصل الى\n\n7.50 %\n\nالربع سنوي يصل الى\n\n7.60 %\n\nالنصف سنوي يصل الى\n\n7.65 %\n\nالسنوي يصل الى\n\n7.75 %\n\nالأوراق المطلوبة\n\nنسخة من بطاقة الهوية / جواز السفر وبأبسط الإجراءات\n\nمميزات أخري\n\nالحد الأقصى لرصيد الحساب: 1 مليون جنيها مصريًا\n\nالحد الأقصى لحركات الخصم اليومي (سحب نقدي – حوالات صادرة – خصم حسابي ... إلخ) 90 ألف جنيهًا مصريًا\n\nالحد الأقصى لحركات الخصم الشهري ( سحب نقدي – حوالات صادرة – خصم حسابي ... إلخ) 300 الف جنيهًا مصريًا\n\nتامين  مجاني علي الحياه للعميل\n\nيستحق  التامين اعتبارا من الشهر التالي لتاريخ فتح الحساب علي اقل رصيد دائن بالحساب خلال الشهر بحد ادني مبلغ 5000 جم و بحد اقصي للتامين مبلغ 100 الف جم\n\nيتم دفع مبلغ التامين وفقا واقل رصيد دائن للشهر السابق لتاريخ الوفاه.\n\nالتامين سارى للعملاء من سن 15 وحتى 60 سنه.\n\nبشرط الا يقل سن العميل عن 15 سنه ولا يزيد عن 50 سنه عند بدء التأمين.\n\nاصدار محفظة فون كاش معفاة من (مصاريف الاصدار- مصاريف سنوية لمده سنه من تاريخ الاشتراك بالمحفظة).\n\nإمكانية شراء شهادات الاستثمار ( أ-ب-ج) خصما من الحساب وإضافة قيمة الشهادة و العائد عليه.\n\nيتم احتساب العائد شهريا علي اقل رصيد دائن خلال الشهر و الذي يزيد عن 3000 جنيه و يتم تعليه العائد المحتسب علي رصيد الحساب وفقا و دوريه صرفه\n\nمصاريف فتح الحساب: مجانا\n\nالمصاريف الإدارية: مجانا\n\nمصاريف اصدار بطاقة الخصم المباشر: مجانا\n\nالخدمات المصرفية عبرالإنترنت\n\nبطاقة خصم مباشر للسحب والشراء.\n\nكشف الحساب الالكتروني من خلال الأهلي نت / الأهلي موبايل : مجانا\n\nشرائح الرصيد/دورية العائد\n\nشهري\n\nربع سنوي\n\nنص سنوي\n\nسنوي\n\nحتى 3000 جم\n\n0%\n\nمن 3001 : 100,000 جم\n\n7.25%\n\n7.30%\n\n7.35%\n\n7.45%\n\nمن 100,001 : 1 مليون جم\n\n7.50%\n\n7.60%\n\n7.65%\n\n7.75%\n\n#ProductTypeMiddleContainer#\n\n#ProductMiddleContainer#\n\nمنتجات أخري\n\nحساب توفير المدخر الصغير\n\nالحد الادني لفتح الحساب\n\n1000 جم\n\nحساب توفير المعاش\n\n5000 جم\n\nحساب التوفير\n\n5,000 جم\n\nحساب الأهلي اكسترا توفير\n\n20,000 جم\n\nللمقارنة بين المنتجات اضغط...\n\n#ProductTypeFooterContainer#\n\n#ProductFooterContainer#\n\nهذه الصفحه غير متاحة\n\nSiteMap\n\n1187 كورنيش النيل ، برج البنك الأهلي ، بولاق ، القاهرة ، مصر\n\nمحليا: 19623 - دوليا: 0020219623 / 0020225941200\n\nاتصل بنا على الفور على الخط الساخن على مدار 24-ساعة 19623 للإبلاغ عن مشكلة أو بطاقة مفقودة\n\nCopyrights\n\nFloating Banner\n\nهذه الرسالة تحتوي على بيانات شخصية أو مالية. لذلك, لن يتم تنفيذ طلبك.\n\nبرجاء عدم الإفصاح عن بياناتك الشخصية أو المالية أثناء استخدام الخدمة.\n\nThis message contains personal or financial information.\n\nTherefore, your request cannot be processes here.\n\nPlease do not disclose your personal or financial data when using this service.\n\nConfirm\n\nبرجاء العلم أن الخدمة للاستعلام فقط عن المنتجات والخدمات المقدمة من البنك للعملاء الأفراد والشركات.\n\nمرحبا، 👋\n\nدعنا نتحدث إذا كان لديك أي أسئلة\n\n| شرائح الرصيد/دورية العائد | شهري | ربع سنوي | نص سنوي | سنوي |\n| --- | --- | --- | --- | --- |\n| حتى 3000 جم | 0% |  |  |  |\n| من 3001 : 100,000 جم | 7.25% | 7.30% | 7.35% | 7.45% |\n| من 100,001 : 1 مليون جم | 7.50% | 7.60% | 7.65% | 7.75% |",
  "metadata": {
    "content_hash": "de4bdb47252c89c57cfbe9583040a4b3b79f54f4234171067dc0317baaa1db2c",
    "extracted_at": "2026-07-14T08:39:57.701080+00:00",
    "has_tables": true,
    "source": "playwright_rescrape",
    "error": null
  }
}