{
  "id": "0d7852c6a0e76d6f",
  "title": "البنك الأهلى المصرى - بطاقة ميزة المدفوعة مقدما",
  "url": "https://www.nbe.com.eg/NBE/E/#/AR/ProductDetails?inParams=%7B%22CategoryID%22%3A%22PrepaidCardsID%22%2C%22ProductID%22%3A%22%D8%A8%D8%B7%D8%A7%D9%82%D8%A9%20%D9%85%D9%8A%D8%B2%D8%A9%20%D8%A7%D9%84%D9%85%D8%AF%D9%81%D9%88%D8%B9%D8%A9%20%D9%85%D9%82%D8%AF%D9%85%D8%A7_16535%22%7D",
  "language": "ar",
  "content": "أفراد\n\nالشركات\n\nالمشروعات الصغيرة\n\nبلاتينم\n\nNab Bar Menu\n\nChange Language\n\nالوظائف\n\nSearch Bar\n\nNBE logo\n\nMega Menu\n\nالبطاقات\n\nالبطاقات المدفوعة مقدما\n\nبطاقة ميزة المدفوعة مقدما\n\n#ProductHeaderContainer#\n\nهي اول بطاقة دفع الكتروني وطنية و التي تعد احد الادوات الرئيسية للسداد الالكتروني لمدفوعات المواطن سواء للجهات الحكومية او في كافة التعاملات المالية الاخرى محليا.\n\nخصائص البطاقة\n\nتمكنك من استقبال و صرف الحوالات بالجنية المصري على مدار 24 ساعة دون الحاجة للتوجه لأي من فروع البنك .\n\nالاستفادة من المعاملات اللاتلامسية للحفاظ علي سلامتك\n  .\n\nتمنحك إمكانية الاستمتاع بخدمة الإنترنت البنكي.\n\nتمنحك إمكانية الاستمتاع بخدمات محفظة الهاتف المحمول لدفع فواتيرك وشحن رصيد موبايلك وغيرهم من الخدمات.\n\nتعد بطاقة ميزة المدفوعة مقدما من البنك الاهلي المصري اول بطاقة دفع الكترونية وطنية تمكنك من سداد المدفوعات الحكومية الكترونيا بسهولة و امان\n\nتوفر بطاقة ميزة حرية السحب النقدي من خلال شبكة الصراف الالي الخاصة بالبنك الاهلي المصري او من خلال ماكينات البنوك الأخرى داخل مصر التي تحمل علامة 123 .\n\nوجود شعار ميزة يتيح لك قبول البطاقة لدى شبكة واسعة من التجار المتاح لديهم نقاط البيع الالكترونية و التي تمكنك من شراء السلع و الحصول على الخدمات من خلال البطاقة.\n\nصورة البطاقة الشخصية السارية او جواز السفر الموضح به الرقم القومي.\n\nيرجى زيارة اقرب فرع من فروع مصرفنا\n\nللاطلاع علي الشروط و الأحكام\n\n#ProductTypeMiddleContainer#\n\n#ProductMiddleContainer#\n\nTo compare between products press...\n\n#ProductTypeFooterContainer#\n\nبطاقة ميزة المدفوعة مقدما من البنك الأهلي المصري\n\nس : ما هي بطاقة ميزة المدفوعة مقدما من البنك الأهلي المصري ؟\n\nس : ما هي اجراءات الحصول على هذه البطاقات ؟\n\nالتوجه الى اقرب فرع من فروع البنك الأهلي المصري المنتشرة داخل جمهورية مصر العربية.\n\nاستيفاء طلب الاصدار الخاص ببطاقة ميزة المدفوعة مقدما و ارفاقه مع صورة بطاقة الرقم القومي السارية او جواز سفر ساري موضح به الرقم القومي.\n\nاستلام بطاقة الدفع و انتظار الرسالة النصية الخاصة بتفعيل تلك البطاقة.\n\n\"يتم استلام البطاقة في الحال بدون اسم مطبوع عليها, و في حال طلبكم لبطاقة مطبوع عليها يتم تقديم الطلب و استلام البطاقة خلال مدة يتم افادتكم بها\"\n\nس : هل بمجرد استلام البطاقة يمكن استخدامها ؟\n\nس : و كيف احصل على الرقم السري الخاص بالبطاقة ؟\n\nالبند\n\nبطاقة ميزة\n\nمصاريف الاصدار\n\n30 جم\n\nالمصاريف السنوية\n\n20 جم\n\nمصاريف اصدار بدل فاقد / تالف\n\nعمولة الايداع من خلال ATM / فروع مصرفنا\n\nمجانا\n\nعمولة السحب النقدي من خلال ال ATM الخاصة بمصرفنا\n\nعمولة السحب النقدي من خلال ال ATM الخاصة بالبنوك المحلية\n\n5  جم\n\nعمولة الشراء من المتاجر\n\nالحد الاقصى لرصيد البطاقة\n\n200,000 جم\n\nالحد الاقصى للشراء اليومي / محليا\n\n30,000 جم\n\nالحد الاقصى للسحب النقدي اليومي / محليا\n\nالحد الاقصى للاستخدام اليومي / محليا\n\n60,000 جم\n\nالحد الاقصي للتعامل شهريا بالبطاقة\n\nهذه الصفحه غير متاحة\n\nSiteMap\n\n1187 كورنيش النيل ، برج البنك الأهلي ، بولاق ، القاهرة ، مصر\n\nمحليا: 19623 - دوليا: 0020219623 / 0020225941200\n\nاتصل بنا على الفور على الخط الساخن على مدار 24-ساعة 19623 للإبلاغ عن مشكلة أو بطاقة مفقودة\n\nCopyrights\n\nFloating Banner\n\nهذه الرسالة تحتوي على بيانات شخصية أو مالية. لذلك, لن يتم تنفيذ طلبك.\n\nبرجاء عدم الإفصاح عن بياناتك الشخصية أو المالية أثناء استخدام الخدمة.\n\nThis message contains personal or financial information.\n\nTherefore, your request cannot be processes here.\n\nPlease do not disclose your personal or financial data when using this service.\n\nConfirm\n\nبرجاء العلم أن الخدمة للاستعلام فقط عن المنتجات والخدمات المقدمة من البنك للعملاء الأفراد والشركات.\n\nمرحبا، 👋\n\nدعنا نتحدث إذا كان لديك أي أسئلة\n\n| البندبطاقة ميزةمصاريف الاصدار30 جمالمصاريف السنوية20 جممصاريف اصدار بدل فاقد / تالف30 جمعمولة الايداع من خلال ATM / فروع مصرفنامجاناعمولة السحب النقدي من خلال ال ATM الخاصة بمصرفنامجاناعمولة السحب النقدي من خلال ال ATM الخاصة بالبنوك المحلية5  جمعمولة الشراء من المتاجرمجاناالحد الاقصى لرصيد البطاقة200,000 جمالحد الاقصى للشراء اليومي / محليا30,000 جمالحد الاقصى للسحب النقدي اليومي / محليا30,000 جمالحد الاقصى للاستخدام اليومي / محليا60,000 جمالحد الاقصي للتعامل شهريا بالبطاقة200,000 جم | البند | بطاقة ميزة | مصاريف الاصدار | 30 جم | المصاريف السنوية | 20 جم | مصاريف اصدار بدل فاقد / تالف | 30 جم | عمولة الايداع من خلال ATM / فروع مصرفنا | مجانا | عمولة السحب النقدي من خلال ال ATM الخاصة بمصرفنا | مجانا | عمولة السحب النقدي من خلال ال ATM الخاصة بالبنوك المحلية | 5  جم | عمولة الشراء من المتاجر | مجانا | الحد الاقصى لرصيد البطاقة | 200,000 جم | الحد الاقصى للشراء اليومي / محليا | 30,000 جم | الحد الاقصى للسحب النقدي اليومي / محليا | 30,000 جم | الحد الاقصى للاستخدام اليومي / محليا | 60,000 جم | الحد الاقصي للتعامل شهريا بالبطاقة | 200,000 جم |\n| --- | --- | --- | --- | --- | --- | --- | --- | --- | --- | --- | --- | --- | --- | --- | --- | --- | --- | --- | --- | --- | --- | --- | --- | --- | --- | --- |\n| البند | بطاقة ميزة |  |  |  |  |  |  |  |  |  |  |  |  |  |  |  |  |  |  |  |  |  |  |  |  |  |\n| مصاريف الاصدار | 30 جم |  |  |  |  |  |  |  |  |  |  |  |  |  |  |  |  |  |  |  |  |  |  |  |  |  |\n| المصاريف السنوية | 20 جم |  |  |  |  |  |  |  |  |  |  |  |  |  |  |  |  |  |  |  |  |  |  |  |  |  |\n| مصاريف اصدار بدل فاقد / تالف | 30 جم |  |  |  |  |  |  |  |  |  |  |  |  |  |  |  |  |  |  |  |  |  |  |  |  |  |\n| عمولة الايداع من خلال ATM / فروع مصرفنا | مجانا |  |  |  |  |  |  |  |  |  |  |  |  |  |  |  |  |  |  |  |  |  |  |  |  |  |\n| عمولة السحب النقدي من خلال ال ATM الخاصة بمصرفنا | مجانا |  |  |  |  |  |  |  |  |  |  |  |  |  |  |  |  |  |  |  |  |  |  |  |  |  |\n| عمولة السحب النقدي من خلال ال ATM الخاصة بالبنوك المحلية | 5  جم |  |  |  |  |  |  |  |  |  |  |  |  |  |  |  |  |  |  |  |  |  |  |  |  |  |\n| عمولة الشراء من المتاجر | مجانا |  |  |  |  |  |  |  |  |  |  |  |  |  |  |  |  |  |  |  |  |  |  |  |  |  |\n| الحد الاقصى لرصيد البطاقة | 200,000 جم |  |  |  |  |  |  |  |  |  |  |  |  |  |  |  |  |  |  |  |  |  |  |  |  |  |\n| الحد الاقصى للشراء اليومي / محليا | 30,000 جم |  |  |  |  |  |  |  |  |  |  |  |  |  |  |  |  |  |  |  |  |  |  |  |  |  |\n| الحد الاقصى للسحب النقدي اليومي / محليا | 30,000 جم |  |  |  |  |  |  |  |  |  |  |  |  |  |  |  |  |  |  |  |  |  |  |  |  |  |\n| الحد الاقصى للاستخدام اليومي / محليا | 60,000 جم |  |  |  |  |  |  |  |  |  |  |  |  |  |  |  |  |  |  |  |  |  |  |  |  |  |\n| الحد الاقصي للتعامل شهريا بالبطاقة | 200,000 جم |  |  |  |  |  |  |  |  |  |  |  |  |  |  |  |  |  |  |  |  |  |  |  |  |  |\n\n| البند | بطاقة ميزة |\n| --- | --- |\n| مصاريف الاصدار | 30 جم |\n| المصاريف السنوية | 20 جم |\n| مصاريف اصدار بدل فاقد / تالف | 30 جم |\n| عمولة الايداع من خلال ATM / فروع مصرفنا | مجانا |\n| عمولة السحب النقدي من خلال ال ATM الخاصة بمصرفنا | مجانا |\n| عمولة السحب النقدي من خلال ال ATM الخاصة بالبنوك المحلية | 5  جم |\n| عمولة الشراء من المتاجر | مجانا |\n| الحد الاقصى لرصيد البطاقة | 200,000 جم |\n| الحد الاقصى للشراء اليومي / محليا | 30,000 جم |\n| الحد الاقصى للسحب النقدي اليومي / محليا | 30,000 جم |\n| الحد الاقصى للاستخدام اليومي / محليا | 60,000 جم |\n| الحد الاقصي للتعامل شهريا بالبطاقة | 200,000 جم |",
  "metadata": {
    "content_hash": "907764acba980bef1b39143daa312a8c26afe512b407b1b0d82bada0057f0fd8",
    "extracted_at": "2026-07-14T08:40:50.209412+00:00",
    "has_tables": true,
    "source": "playwright_rescrape",
    "error": null
  }
}