{
  "id": "6fafc3565d7a40f1",
  "title": "البنك الأهلى المصرى - حساب توفير المستقبل",
  "url": "https://www.nbe.com.eg/NBE/E/#/AR/ProductDetails?inParams=%7B%22CategoryID%22%3A%22SavingForeignAccountsID%22%2C%22ProductID%22%3A%22%D8%AD%D8%B3%D8%A7%D8%A8%20%D8%AA%D9%88%D9%81%D9%8A%D8%B1%20%D8%A7%D9%84%D9%85%D8%B3%D8%AA%D9%82%D8%A8%D9%84_19862%22%7D",
  "language": "ar",
  "content": "أفراد\n\nالشركات\n\nالمشروعات الصغيرة\n\nبلاتينم\n\nNab Bar Menu\n\nChange Language\n\nالوظائف\n\nSearch Bar\n\nNBE logo\n\nMega Menu\n\nالحسابات\n\nحسابات التوفير\n\nحسابات التوفير- عملة أجنبية\n\nحساب توفير المستقبل\n\n#ProductHeaderContainer#\n\nالخصائص\n\nبدون حد ادني لفتح الحساب\n\n100 دولار أمريكي - يورو - جنيه إسترليني\n\nالعملاء من سن 15 سنة و بدون حد اقصي\n\nسعر العائد\n\nالشهري يصل الى\n\n1.50 % سنويًا\n\nالسنوي يصل الى\n\n2.00 % سنويًا\n\nالأوراق المطلوبة\n\nبطاقة الهوية / جواز السفر\n\nمميزات أخري\n\nالحد الأقصى لرصيد الحساب: 20 ألف دولار أمريكي - يورو - جنيه إسترليني.\n\nالحد الأقصى لحركات الخصم اليومي (سحب نقدي – حوالات صادرة – خصم حسابي ... إلخ) ما يعادل 90 ألف جنيه مصري.\n\nالحد الأقصى لحركات الخصم الشهري (سحب نقدي – حوالات صادرة – خصم حسابي ... إلخ) ما يعادل 300 ألف جنيه مصري.\n\nغير متاح إصدار بطاقة خصم مباشر.\n\nإمكانية شراء الشهادات / الودائع بالعملة الأجنبية وإضافة العائد على الحساب.\n\nمصاريف فتح الحساب: مجانًا.\n\nالمصاريف الإدارية (طبقا لعملة الحساب): 1 (دولار أمريكي, يورو, جنيه إسترليني) تخصم كل 3 شهور.\n\nكشف الحساب الورقي: ما يعادل 100 جم للكشف يخصم كل 3 شهور.\n\nكشف الحساب الإلكتروني من خلال الأهلي نت / الأهلي موبايل: مجانًا.\n\n(جوائز دورية من خلال الدخول في سحب ربع سنوي بالمحددات التالية (لعملة الدولار الأمريكي فقط:\n\nلكل 100 دولار أمريكي يحتفظ بها العميل بالحساب كل 3 أشهر فرصة للفوز ودخول السحب.\n\nقيمه الجائزة: 50 ألف جم يتم إضافتها على بطاقة مسبقة الدفع (ميزة) أو حساب العميل بالعملة المحلية إن وجد.\n\nعدد 2 عملاء الفائزين ربع سنويًا.\n\nموعد إجراء السحب: خلال أشهر (يناير، إبريل، يوليو، أكتوبر).\n\nيحصل العميل الفائز على صافي مبلغ الجائزة بعد استقطاع نسبة  30%الخاصة بمصلحة الضرائب ووزارة التضامن الاجتماعي تطبيقًا للشروط والأحكام.\n\nيتم استبعاد العملاء الفائزين في السحوبات السابقة.\n\nشرائح الرصيد/دورية العائد\n\nدولار أمريكي\n\nيورو\n\nجنيه إسترليني\n\nيصرف شهري\n\nيصرف سنوي\n\nمن 100 وحتى 5,000 (دولار أمريكي - يورو  - جنيه إسترليني)\n\n1.00% سنويًا\n\n1.25% سنويًا\n\n0.50%\nسنويًا\n\n0.75%\nسنويًا\n\n1.00%\nسنويًا\n\nمن 5,001 وحتى 20,000 (دولار أمريكي - يورو - جنيه إسترليني)\n\n1.50% سنويًا\n\n2.00%\nسنويًا\n\n1.25%\nسنويًا\n\n1.50%\nسنويًا\n\n#ProductTypeMiddleContainer#\n\n#ProductMiddleContainer#\n\nمنتجات أخري\n\nحساب التوفير\n\nالحد الادني لفتح الحساب وإحتساب العائد\n\n100\n\n#ProductTypeFooterContainer#\n\n#ProductFooterContainer#\n\nهذه الصفحه غير متاحة\n\nSiteMap\n\n1187 كورنيش النيل ، برج البنك الأهلي ، بولاق ، القاهرة ، مصر\n\nمحليا: 19623 - دوليا: 0020219623 / 0020225941200\n\nاتصل بنا على الفور على الخط الساخن على مدار 24-ساعة 19623 للإبلاغ عن مشكلة أو بطاقة مفقودة\n\nCopyrights\n\nFloating Banner\n\nهذه الرسالة تحتوي على بيانات شخصية أو مالية. لذلك, لن يتم تنفيذ طلبك.\n\nبرجاء عدم الإفصاح عن بياناتك الشخصية أو المالية أثناء استخدام الخدمة.\n\nThis message contains personal or financial information.\n\nTherefore, your request cannot be processes here.\n\nPlease do not disclose your personal or financial data when using this service.\n\nConfirm\n\nبرجاء العلم أن الخدمة للاستعلام فقط عن المنتجات والخدمات المقدمة من البنك للعملاء الأفراد والشركات.\n\nمرحبا، 👋\n\nدعنا نتحدث إذا كان لديك أي أسئلة\n\n| شرائح الرصيد/دورية العائد | دولار أمريكي | يورو | جنيه إسترليني |\n| --- | --- | --- | --- |\n| يصرف شهري | يصرف سنوي | يصرف شهري | يصرف سنوي |\n| من 100 وحتى 5,000 (دولار أمريكي - يورو  - جنيه إسترليني) | 1.00% سنويًا | 1.25% سنويًا | 0.50%\nسنويًا |\n| من 5,001 وحتى 20,000 (دولار أمريكي - يورو - جنيه إسترليني) | 1.50% سنويًا | 2.00%\nسنويًا | 1.00% سنويًا |",
  "metadata": {
    "content_hash": "16474c7a444a799d62b96c5681ecdd56620b526539a423cd744e0b04a5b80a4f",
    "extracted_at": "2026-07-14T08:39:52.823825+00:00",
    "has_tables": true,
    "source": "playwright_rescrape",
    "error": null
  }
}