{
  "id": "f4faca5a5030f81d",
  "title": "البنك الأهلى المصرى - شهادة استثمار ' أ '",
  "url": "https://www.nbe.com.eg/NBE/E/#/AR/ProductDetails?inParams=%7B%22CategoryID%22%3A%22InvestmentCertificateCatID%22%2C%22ProductID%22%3A%22%D8%B4%D9%87%D8%A7%D8%AF%D8%A9%20%D8%A7%D8%B3%D8%AA%D8%AB%D9%85%D8%A7%D8%B1%20'%20%D8%A3%20'_6349%22%7D",
  "language": "ar",
  "content": "أفراد\n\nالشركات\n\nالمشروعات الصغيرة\n\nبلاتينم\n\nNab Bar Menu\n\nChange Language\n\nالوظائف\n\nSearch Bar\n\nNBE logo\n\nMega Menu\n\nشهادات الادخار\n\nشهادات الاستثمار\n\nشهادة استثمار ' أ '\n\n#ProductHeaderContainer#\n\nفئات الشهادة\n\n500\n\nجم\n\nومضاعفاتها\n\nالمدة\n\nسنوات\n\n10\n\nدورية صرف العائد\n\nفوائد تراكمية\n\nسعر العائد\n\n12%\n\nمن يحق لهم الشراء\n\nتصدر الشهادات للأشخاص الطبيعيين المصريين والأجانب بالغين و قصر\n\nالاقتراض\n\nيجوز الاقتراض بضمان هذه الشهادات من أي من فروع مصرفنا وفقاً والتعليمات السارية و اسعار العوائد في تاريخ الاقتراض\n\nألاسترداد\n\nتسترد الشهادة في نهاية مدتها بكامل قيمتها الاستحقاقية, و يمكن أستردادها بعد مضي ستة أشهر من يوم العمل التالي ليوم الشراء وفقا و القيم الاستردادية المعدة في هذا الشأن.\n\nمميزات أخري\n\nالعائد مجمع يمنح في نهاية مدة الشهادة\n\nتدر الشهادات عائد تراكمي بسعر عائد ثابت طوال مدة الشهادة يحدد وفقا للسعر السائد في تاريخ اصدار الشهادات و يحتسب اعتبارا من يوم العمل التالي لتاريخ الشراء\n\n#ProductTypeMiddleContainer#\n\n#ProductMiddleContainer#\n\nمنتجات اخرى\n\nشهادة استثمار ' ب '\n\nشهادة استثمار 'ج '\n\n20\n\nللمقارنة بين المنتجات إضغط ...\n\n#ProductTypeFooterContainer#\n\n#ProductFooterContainer#\n\nهذه الصفحه غير متاحة\n\nSiteMap\n\n1187 كورنيش النيل ، برج البنك الأهلي ، بولاق ، القاهرة ، مصر\n\nمحليا: 19623 - دوليا: 0020219623 / 0020225941200\n\nاتصل بنا على الفور على الخط الساخن على مدار 24-ساعة 19623 للإبلاغ عن مشكلة أو بطاقة مفقودة\n\nCopyrights\n\nFloating Banner\n\nهذه الرسالة تحتوي على بيانات شخصية أو مالية. لذلك, لن يتم تنفيذ طلبك.\n\nبرجاء عدم الإفصاح عن بياناتك الشخصية أو المالية أثناء استخدام الخدمة.\n\nThis message contains personal or financial information.\n\nTherefore, your request cannot be processes here.\n\nPlease do not disclose your personal or financial data when using this service.\n\nConfirm\n\nبرجاء العلم أن الخدمة للاستعلام فقط عن المنتجات والخدمات المقدمة من البنك للعملاء الأفراد والشركات.\n\nمرحبا، 👋\n\nدعنا نتحدث إذا كان لديك أي أسئلة",
  "metadata": {
    "content_hash": "c5074dee596848a707c45f165b936fea334b3c282b8829388480dd19d9c8cf27",
    "extracted_at": "2026-07-14T08:39:23.011599+00:00",
    "has_tables": false,
    "source": "playwright_rescrape",
    "error": null
  }
}