{
  "id": "0f91703c57c78c61",
  "title": "البنك الأهلى المصرى - الذهبية الجديدة",
  "url": "https://www.nbe.com.eg/NBE/E/#/AR/ProductDetails?inParams=%7B%22CategoryID%22%3A%22ForigenCertificatesID%22%2C%22ProductID%22%3A%22%D8%A7%D9%84%D8%B0%D9%87%D8%A8%D9%8A%D8%A9%20%D8%A7%D9%84%D8%AC%D8%AF%D9%8A%D8%AF%D8%A9_16552%22%7D",
  "language": "ar",
  "content": "أفراد\n\nالشركات\n\nالمشروعات الصغيرة\n\nبلاتينم\n\nNab Bar Menu\n\nChange Language\n\nالوظائف\n\nSearch Bar\n\nNBE logo\n\nMega Menu\n\nشهادات الادخار\n\nشهادات الادخار بالعملات الاجنبية\n\nالذهبية الجديدة\n\n#ProductHeaderContainer#\n\n500\n\nدولار أمريكي / يورو\n\nومضاعفاتها\n\nسنوات\n\nدولار - 3 سنوات\n\nدولار - 5 سنوات\n\nدولار - 7 سنوات\n\nيورو (3 سنوات وعائد ربع سنوي فقط)\n\nالاقتراض\n\nيمكن الاقتراض بضمان هذه الشهادات من أي من فروع مصرفنا وفقاً والتعليمات السارية.\n\nالاسترداد\n\nلا يمكن الاسترداد قبل مضي 6 اشهر.\n\nيمكن استردادها قبل نهاية المدة وفقا والقواعد والشروط المعلنة في البنك.\n\nمميزات اخرى\n\nنوع العائد\n\nثابت طول مدة الشهادة.\n\nيحسب من يوم العمل التالي ليوم الشراء و يستحق بنفس عملة الشهادة.\n\n#ProductTypeMiddleContainer#\n\n#ProductMiddleContainer#\n\nمنتجات أخري\n\n#ProductOtherLayoutContainer#\n\nللمقارنة بين المنتجات إضغط ...\n\n#ProductTypeFooterContainer#\n\n#ProductFooterContainer#\n\nهذه الصفحه غير متاحة\n\nSiteMap\n\n1187 كورنيش النيل ، برج البنك الأهلي ، بولاق ، القاهرة ، مصر\n\nمحليا: 19623 - دوليا: 0020219623 / 0020225941200\n\nاتصل بنا على الفور على الخط الساخن على مدار 24-ساعة 19623 للإبلاغ عن مشكلة أو بطاقة مفقودة\n\nCopyrights\n\nFloating Banner\n\nهذه الرسالة تحتوي على بيانات شخصية أو مالية. لذلك, لن يتم تنفيذ طلبك.\n\nبرجاء عدم الإفصاح عن بياناتك الشخصية أو المالية أثناء استخدام الخدمة.\n\nThis message contains personal or financial information.\n\nTherefore, your request cannot be processes here.\n\nPlease do not disclose your personal or financial data when using this service.\n\nConfirm\n\nبرجاء العلم أن الخدمة للاستعلام فقط عن المنتجات والخدمات المقدمة من البنك للعملاء الأفراد والشركات.\n\nمرحبا، 👋\n\nدعنا نتحدث إذا كان لديك أي أسئلة",
  "metadata": {
    "content_hash": "0bd84270b6102bb7fe11420852a3dc70734c9f18797f7e587d112140f5de9589",
    "extracted_at": "2026-07-14T08:39:19.332254+00:00",
    "has_tables": false,
    "source": "playwright_rescrape",
    "error": null
  }
}