{
  "id": "de73a8b9d5c716a3",
  "title": "البنك الأهلى المصرى - حساب التوفير",
  "url": "https://www.nbe.com.eg/NBE/E/#/AR/ProductDetails?inParams=%7B%22CategoryID%22%3A%22SavingForeignAccountsID%22%2C%22ProductID%22%3A%22%D8%AD%D8%B3%D8%A7%D8%A8%20%D8%A7%D9%84%D8%AA%D9%88%D9%81%D9%8A%D8%B1_16558%22%7D",
  "language": "ar",
  "content": "أفراد\n\nالشركات\n\nالمشروعات الصغيرة\n\nبلاتينم\n\nNab Bar Menu\n\nChange Language\n\nالوظائف\n\nSearch Bar\n\nNBE logo\n\nMega Menu\n\nالحسابات\n\nحسابات التوفير\n\nحسابات التوفير- عملة أجنبية\n\nحساب التوفير\n\n#ProductHeaderContainer#\n\n100\n\nدولار امريكي - يورو - جنيه استرليني\n\nسنوي\n\nمصري\n\nأجنبي\n\nقاصر (باسمه تحت الولاية أو الوصاية أو الهبة ).\n\nالأوراق المطلوبة\n\nنسخة من بطاقة الهوية / جواز السفر\n\nشهادة الميلاد للقصر\n\nمميزات اخري\n\nتمتع بعائد علي مدخراتك بالعملة الاجنبية.\n\nالخدمات المصرفية عبر الإنترنت.\n\nحساب مشترك.\n\nتمتع بالإعفاء من مصاريف فتح الحساب والحد الأدنى لفتح الحساب عند فتح حسابك من خلال الأهلي نت/الأهلي موبايل.\n\n#ProductTypeMiddleContainer#\n\n#ProductMiddleContainer#\n\nمنتجات أخري\n\nحساب توفير المستقبل\n\nالحد الادني لفتح الحساب وإحتساب العائد\n\n#ProductTypeFooterContainer#\n\n#ProductFooterContainer#\n\nهذه الصفحه غير متاحة\n\nSiteMap\n\n1187 كورنيش النيل ، برج البنك الأهلي ، بولاق ، القاهرة ، مصر\n\nمحليا: 19623 - دوليا: 0020219623 / 0020225941200\n\nاتصل بنا على الفور على الخط الساخن على مدار 24-ساعة 19623 للإبلاغ عن مشكلة أو بطاقة مفقودة\n\nCopyrights\n\nFloating Banner\n\nهذه الرسالة تحتوي على بيانات شخصية أو مالية. لذلك, لن يتم تنفيذ طلبك.\n\nبرجاء عدم الإفصاح عن بياناتك الشخصية أو المالية أثناء استخدام الخدمة.\n\nThis message contains personal or financial information.\n\nTherefore, your request cannot be processes here.\n\nPlease do not disclose your personal or financial data when using this service.\n\nConfirm\n\nبرجاء العلم أن الخدمة للاستعلام فقط عن المنتجات والخدمات المقدمة من البنك للعملاء الأفراد والشركات.\n\nمرحبا، 👋\n\nدعنا نتحدث إذا كان لديك أي أسئلة",
  "metadata": {
    "content_hash": "a0f845252967a29519b1fcec4458bfe854b6c1e7fe60074649921e640d29ff71",
    "extracted_at": "2026-07-14T08:39:50.814237+00:00",
    "has_tables": false,
    "source": "playwright_rescrape",
    "error": null
  }
}