{
  "id": "a3bbcbd9137866d8",
  "title": "البنك الأهلى المصرى - فيزا بلاتينم الدولارية",
  "url": "https://www.nbe.com.eg/NBE/E/#/AR/ProductDetails?inParams=%7B%22CategoryID%22%3A%22CreditCardsID%22%2C%22ProductID%22%3A%22%D9%81%D9%8A%D8%B2%D8%A7%20%D8%A8%D9%84%D8%A7%D8%AA%D9%8A%D9%86%D9%85%20%D8%A7%D9%84%D8%AF%D9%88%D9%84%D8%A7%D8%B1%D9%8A%D8%A9_19859%22%7D",
  "language": "ar",
  "content": "أفراد\n\nالشركات\n\nالمشروعات الصغيرة\n\nبلاتينم\n\nNab Bar Menu\n\nChange Language\n\nالوظائف\n\nSearch Bar\n\nNBE logo\n\nMega Menu\n\nالبطاقات\n\nبطاقات الإئتمان\n\nفيزا بلاتينم الدولارية\n\n#ProductHeaderContainer#\n\nمميزات البطاقة\n\n50,000\n\nدولار أمريكي\n\nحتي 55 يوم\n\nعلى المشتريات فقط\n\n50 دولار أمريكي\n\nمجانا\n\n1,000 دولار أمريكي\n\nيوميا\n\nكيفية إصدار البطاقة\n\nيتم إصدار منتج فيزا بلاتينم الائتمانية بالدولار الأمريكي بضمان الشهادات الدولارية فقط فيما عدا شهادات (الأهلي فورا – بلادي)\n\nللتقدم بطلب إصدار البطاقة الائتمانية بعملة الدولار الأمريكي برجاء التوجه لأقرب فرع.\n\nبرنامج نقاط الأهلي للمكافات\n\nالحصول على 22 نقطة لكل دولار أمريكي يتم استخدامه في المشتريات\n\nمزايا اضافية\n\nخدمة النصح الطبي و القانوني حول العالم .\n\nإمكانيه مضاعفة فترة الضمان لجميع السلع عند الشراء ببطاقة فيزا البنك الاهلي المصري البلاتينية الائتمانية والتي تصل الى 12 شهر مقدمة من هيئة فيزا\n\nالتامين الشامل ضد الفقد او التلف لجميع مشترياتكم ببطاقة فيزا البنك الاهلي المصري البلاتينية الائتمانية مقدمة من هيئة فيزا.\n\nلمزيد من التفاصيل عن مزايا حول العالم ، يمكنك زيارة موقع فيزا الإلكتروني Visa Middle East\n\nتمنح شركة فيزا حاملي بطاقات فيزا بلاتينم الائتمانية الصادرة في مصر ميزة الاستفادة بعدد 6 مرات من الدخول المجاني إلى صالات المطارات حول العالم.\n\nيمكنكم الاستمتاع بخدمة الدخول إلي صالات المطارات المقدمة من شركة فيزا، من خلال تحميل تطبيق الهاتف المحمول Visa Airport Companion.\n\n#ProductTypeMiddleContainer#\n\n#ProductMiddleContainer#\n\nمنتجات آخرى\n\n#ProductOtherLayoutContainer#\n\nللمقارنة بين المنتجات اضغط ...\n\n#ProductTypeFooterContainer#\n\n#ProductFooterContainer#\n\nهذه الصفحه غير متاحة\n\nSiteMap\n\n1187 كورنيش النيل ، برج البنك الأهلي ، بولاق ، القاهرة ، مصر\n\nمحليا: 19623 - دوليا: 0020219623 / 0020225941200\n\nاتصل بنا على الفور على الخط الساخن على مدار 24-ساعة 19623 للإبلاغ عن مشكلة أو بطاقة مفقودة\n\nCopyrights\n\nFloating Banner\n\nهذه الرسالة تحتوي على بيانات شخصية أو مالية. لذلك, لن يتم تنفيذ طلبك.\n\nبرجاء عدم الإفصاح عن بياناتك الشخصية أو المالية أثناء استخدام الخدمة.\n\nThis message contains personal or financial information.\n\nTherefore, your request cannot be processes here.\n\nPlease do not disclose your personal or financial data when using this service.\n\nConfirm\n\nبرجاء العلم أن الخدمة للاستعلام فقط عن المنتجات والخدمات المقدمة من البنك للعملاء الأفراد والشركات.\n\nمرحبا، 👋\n\nدعنا نتحدث إذا كان لديك أي أسئلة",
  "metadata": {
    "content_hash": "710b7fdb3d72e48e326013e6e73adfebfa0c11ee7189e54c4c0f2377b9e3efd8",
    "extracted_at": "2026-07-14T08:40:16.643258+00:00",
    "has_tables": false,
    "source": "playwright_rescrape",
    "error": null
  }
}