{
  "id": "1170480bb1052e0f",
  "title": "البنك الأهلى المصرى - ماستركارد مصر للطيران",
  "url": "https://www.nbe.com.eg/NBE/E/#/AR/ProductDetails?inParams=%7B%22CategoryID%22%3A%22CreditCardsID%22%2C%22ProductID%22%3A%22%D9%85%D8%A7%D8%B3%D8%AA%D8%B1%D9%83%D8%A7%D8%B1%D8%AF%20%D9%85%D8%B5%D8%B1%20%D9%84%D9%84%D8%B7%D9%8A%D8%B1%D8%A7%D9%86_16604%22%7D",
  "language": "ar",
  "content": "أفراد\n\nالشركات\n\nالمشروعات الصغيرة\n\nبلاتينم\n\nNab Bar Menu\n\nChange Language\n\nالوظائف\n\nSearch Bar\n\nNBE logo\n\nMega Menu\n\nالبطاقات\n\nبطاقات الإئتمان\n\nماستركارد مصر للطيران\n\n#ProductHeaderContainer#\n\nمميزات البطاقة\n\n9,999\n\nجم\n\nحتي 55 يوم\n\nعلى المشتريات فقط\n\n25\n\nمجانا\n\n30,000 جم\n\nيوميا\n\nبرنامج نقاط الأهلي للمكافات\n\nالحصول على نقطة  لكل جنيه يتم استخدامه في المشتريات\n\nمزايا اضافية\n\n#ProductTypeMiddleContainer#\n\n#ProductMiddleContainer#\n\nمنتجات آخرى\n\n#ProductOtherLayoutContainer#\n\nللمقارنة بين المنتجات اضغط ...\n\n#ProductTypeFooterContainer#\n\nمميزات بطاقات الائتمان\n\nالمرونة\n\nاستخدام البطاقة محليا ودوليا في المشتريات والسحب النقدى.\n\nالامان\n\nالتسوق الامن عبر الأنترنت من خلال خدمة الكود الامن للشراء ( OTP )\n\n24/7 الأهلي فون\n\nنتشرف بخدمتكم واجابة جميع استفساراتكم من خلال خدمة\nالأهلي فون 19623 محليا و 0020219623 على الصعيد الدولي\n\nهذه الصفحه غير متاحة\n\nSiteMap\n\n1187 كورنيش النيل ، برج البنك الأهلي ، بولاق ، القاهرة ، مصر\n\nمحليا: 19623 - دوليا: 0020219623 / 0020225941200\n\nاتصل بنا على الفور على الخط الساخن على مدار 24-ساعة 19623 للإبلاغ عن مشكلة أو بطاقة مفقودة\n\nCopyrights\n\nFloating Banner\n\nهذه الرسالة تحتوي على بيانات شخصية أو مالية. لذلك, لن يتم تنفيذ طلبك.\n\nبرجاء عدم الإفصاح عن بياناتك الشخصية أو المالية أثناء استخدام الخدمة.\n\nThis message contains personal or financial information.\n\nTherefore, your request cannot be processes here.\n\nPlease do not disclose your personal or financial data when using this service.\n\nConfirm\n\nبرجاء العلم أن الخدمة للاستعلام فقط عن المنتجات والخدمات المقدمة من البنك للعملاء الأفراد والشركات.\n\nمرحبا، 👋\n\nدعنا نتحدث إذا كان لديك أي أسئلة",
  "metadata": {
    "content_hash": "0b91ff15c462a6b95852f28b0adffcefc2529531cd447063953906f0cdfb78f7",
    "extracted_at": "2026-07-14T08:40:12.322060+00:00",
    "has_tables": false,
    "source": "playwright_rescrape",
    "error": null
  }
}