{
  "id": "f9d0923ab6229742",
  "title": "البنك الأهلى المصرى - حساب فايدة بلس",
  "url": "https://www.nbe.com.eg/NBE/E/#/AR/ProductDetails?inParams=%7B%22CategoryID%22%3A%22CurrentAccountsID%22%2C%22ProductID%22%3A%22%D8%AD%D8%B3%D8%A7%D8%A8%20%D9%81%D8%A7%D9%8A%D8%AF%D8%A9%20%D8%A8%D9%84%D8%B3_18705%22%7D",
  "language": "ar",
  "content": "أفراد\n\nالشركات\n\nالمشروعات الصغيرة\n\nبلاتينم\n\nNab Bar Menu\n\nChange Language\n\nالوظائف\n\nSearch Bar\n\nNBE logo\n\nMega Menu\n\nالحسابات\n\nالحسابات الجارية\n\nحساب فايدة بلس\n\n10,000  جم\n\nجنيه مصري\n\n50,000 جم\n\nيوميا\n\nشهري\n\nربع سنوي\n\nنصف سنوي\n\nسنوي\n\nالمميزات\n\nاحتساب العائد و مميزات أخرى\n\nيتم احتساب العائد على رصيد الحساب بتاريخ إقفال يوم العمل السابق بنسبة مخصومة من مؤشر CONIA.\n\nمؤشر CONIA هو متوسط سعر الفائدة لليله الواحدة للتعاملات بين البنوك، ويتم نشر تسعير مؤشر CONIA كل يوم عمل على موقع البنك المركزي المصري الرسمي\n\nتمتع بالإعفاء من مصاريف فتح الحساب والحد الأدنى لفتح الحساب عند فتح حسابك من خلال الأهلي نت/الأهلي موبايل.\n\nالأوراق المطلوبة\n\nنسخة من بطاقة الرقم القومي/جواز السفر.\n\nشهادة الميلاد للقاصر.\n\n#ProductTypeMiddleContainer#\n\n#ProductMiddleContainer#\n\nمنتجات أخري\n\n#ProductOtherLayoutContainer#\n\nللمقارنة بين المنتجات اضغط...\n\n#ProductTypeFooterContainer#\n\n#ProductFooterContainer#\n\nهذه الصفحه غير متاحة\n\nSiteMap\n\n1187 كورنيش النيل ، برج البنك الأهلي ، بولاق ، القاهرة ، مصر\n\nمحليا: 19623 - دوليا: 0020219623 / 0020225941200\n\nاتصل بنا على الفور على الخط الساخن على مدار 24-ساعة 19623 للإبلاغ عن مشكلة أو بطاقة مفقودة\n\nCopyrights\n\nFloating Banner\n\nهذه الرسالة تحتوي على بيانات شخصية أو مالية. لذلك, لن يتم تنفيذ طلبك.\n\nبرجاء عدم الإفصاح عن بياناتك الشخصية أو المالية أثناء استخدام الخدمة.\n\nThis message contains personal or financial information.\n\nTherefore, your request cannot be processes here.\n\nPlease do not disclose your personal or financial data when using this service.\n\nConfirm\n\nبرجاء العلم أن الخدمة للاستعلام فقط عن المنتجات والخدمات المقدمة من البنك للعملاء الأفراد والشركات.\n\nمرحبا، 👋\n\nدعنا نتحدث إذا كان لديك أي أسئلة",
  "metadata": {
    "content_hash": "a3bf832b26f418e72f23a3a05a99d4a0ef95c2cd41fd2f3fb1b60d7d517f45ca",
    "extracted_at": "2026-07-14T08:39:36.295900+00:00",
    "has_tables": false,
    "source": "playwright_rescrape",
    "error": null
  }
}