{
  "id": "2ddef83aec4257cd",
  "title": "البنك الأهلى المصرى - شهادة استثمار 'ج '",
  "url": "https://www.nbe.com.eg/NBE/E/#/AR/ProductDetails?inParams=%7B%22CategoryID%22%3A%22InvestmentCertificateCatID%22%2C%22ProductID%22%3A%22%D8%B4%D9%87%D8%A7%D8%AF%D8%A9%20%D8%A7%D8%B3%D8%AA%D8%AB%D9%85%D8%A7%D8%B1%20'%D8%AC%20'_16562%22%7D",
  "language": "ar",
  "content": "أفراد\n\nالشركات\n\nالمشروعات الصغيرة\n\nبلاتينم\n\nNab Bar Menu\n\nChange Language\n\nالوظائف\n\nSearch Bar\n\nNBE logo\n\nMega Menu\n\nشهادات الادخار\n\nشهادات الاستثمار\n\nشهادة استثمار 'ج '\n\n#ProductHeaderContainer#\n\nفئات الشهادة\n\n500\n\nجم\n\nالمدة\n\nسنة\n\n20\n\nدورية صرف العائد\n\nلا يوجد عائد\n\nسعر العائد\n\nمن يحق لهم الشراء\n\nالأفراد الطبيعيين المصريين فقط (بالغين و قصر)\n\nالاقتراض\n\nيتم الاقتراض بضمان شهادات استثمار المجموعة 'ج'\n\nألاسترداد\n\nيمكن استردادها بكامل القيمة الاسمية بعد مرور ستة اشهر من يوم العمل التالي لتاريخ شراء الشهادة من اي من فروع مصرفنا ما لم يوجد ما يحول دون ذلك\n\nمميزات أخري\n\nمدة الشهادة 20 سنة.\n\nتحمل كل شهادة أرقاما بعدد ما تحتويه من جنيهات و لكل رقم منها حق الدخول في السحب على الجوائز.\n\nسحب دورى ست مرات شهرياً تتمتع به جميع الشهادات المباعـة بعـد مضى شهر على شهـر الشراء ولمـدة عشرون عاما طالما لـم تستـرد قيمتها من البنك.\n\nسحب مميز كل شهرين (6 مرات سنويا ) تتمتع به الشهـادات التـى مضى على شرائها ثلاث سنوات فأكثر.\n\nسحب  15 مارس و 15 سبتمبر (مرتين سنويا) من كل عام يقتصر الدخول فيه على الشهادات التى مضى علـى شرائها خمـس سنوات فأكثر.\n\nتتمتع الشهادات بفرص دخول السحوبات التالية :\n\nسحب دورى ست مرات شهرياً تتمتع به جميع الشهادات المباعـة بعـد مضى شهر على شهـر الشراء ولمـدة عشرون عاما طالما لـم تستـرد قيمتها من البنك ، وجوائزه كالتالى :\n\nجائزة أولى 30000 جم ' ثلاثون ألف جنيه ' .\n\nجائزة ثانية 15000 جم ' خمسة عشر ألف جنيه ' .\n\nجائزة ثالثة 10000 جـم ' عـشرة آلاف جنيه ' بالإضافة إلـى جوائز مالية أخرى عديدة.\n\nسحب مميز كل شهرين (6 مرات سنويا ) تتمتع به الشهـادات التـى مضى على شرائها ثلاث سنوات فأكثر ، وجوائزه كالتالى :\n\nجائزة أولـى 40000 جم ' اربعون ألف جنيه'\n\nجائزة ثانيــة 15000 جــم ' خمسة عشر ألف جنيـه ' بالإضافـة إلى جوائز مالية أخرى عديدة\n\nسحب  15 مارس و 15 سبتمبر (مرتين سنويا) من كل عام يقتصر الدخول فيه على الشهادات التى مضى علـى شرائها خمـس سنوات فأكثر ، وجوائزه كالتالى :\n\nجائزة أولى 100000 جم ' مائة ألف جنيـه '\n\nجائزة ثانية 50000 جم ' خمسون ألف جنيـه ' بالإضافـة إلـى جوائز مالية أخرى عديدة\n\nكما يمكنكم الاستعلام عن الجوائز من خلال أي من فروع مصرفنا\n\n#ProductTypeMiddleContainer#\n\n#ProductMiddleContainer#\n\nمنتجات اخرى\n\nشهادة استثمار ' ب '\n\nومضاعفاتها\n\nشهادة استثمار ' أ '\n\n10\n\nللمقارنة بين المنتجات إضغط ...\n\n#ProductTypeFooterContainer#\n\n#ProductFooterContainer#\n\nهذه الصفحه غير متاحة\n\nSiteMap\n\n1187 كورنيش النيل ، برج البنك الأهلي ، بولاق ، القاهرة ، مصر\n\nمحليا: 19623 - دوليا: 0020219623 / 0020225941200\n\nاتصل بنا على الفور على الخط الساخن على مدار 24-ساعة 19623 للإبلاغ عن مشكلة أو بطاقة مفقودة\n\nCopyrights\n\nFloating Banner\n\nهذه الرسالة تحتوي على بيانات شخصية أو مالية. لذلك, لن يتم تنفيذ طلبك.\n\nبرجاء عدم الإفصاح عن بياناتك الشخصية أو المالية أثناء استخدام الخدمة.\n\nThis message contains personal or financial information.\n\nTherefore, your request cannot be processes here.\n\nPlease do not disclose your personal or financial data when using this service.\n\nConfirm\n\nبرجاء العلم أن الخدمة للاستعلام فقط عن المنتجات والخدمات المقدمة من البنك للعملاء الأفراد والشركات.\n\nمرحبا، 👋\n\nدعنا نتحدث إذا كان لديك أي أسئلة",
  "metadata": {
    "content_hash": "3f06e6de6835060d780a04b764c7c1c06ab71508f6c348ddf7c8c911d1561ab1",
    "extracted_at": "2026-07-14T08:39:29.015792+00:00",
    "has_tables": false,
    "source": "playwright_rescrape",
    "error": null
  }
}