{
  "id": "b2bf54b6c4a0f944",
  "title": "البنك الأهلى المصرى - البطاقات المدفوعة مقدما من البنك الأهلى المصري",
  "url": "https://www.nbe.com.eg/NBE/E/#/AR/ProductDetails?inParams=%7B%22CategoryID%22%3A%22PrepaidCardsID%22%2C%22ProductID%22%3A%22%D8%A7%D9%84%D8%A8%D8%B7%D8%A7%D9%82%D8%A7%D8%AA%20%D8%A7%D9%84%D9%85%D8%AF%D9%81%D9%88%D8%B9%D8%A9%20%D9%85%D9%82%D8%AF%D9%85%D8%A7%20%D9%85%D9%86%20%D8%A7%D9%84%D8%A8%D9%86%D9%83%20%D8%A7%D9%84%D8%A3%D9%87%D9%84%D9%89%20%D8%A7%D9%84%D9%85%D8%B5%D8%B1%D9%8A_6323%22%7D",
  "language": "ar",
  "content": "أفراد\n\nالشركات\n\nالمشروعات الصغيرة\n\nبلاتينم\n\nNab Bar Menu\n\nChange Language\n\nالوظائف\n\nSearch Bar\n\nNBE logo\n\nMega Menu\n\nالبطاقات\n\nالبطاقات المدفوعة مقدما\n\nالبطاقات المدفوعة مقدما من البنك الأهلى المصري\n\n#ProductHeaderContainer#\n\nخصائص البطاقة\n\nتمكنك من استقبال و صرف الحوالات بالجنية المصري على مدار 24 ساعة دون الحاجة للتوجه لأي من فروع البنك .\n\nالتسوق بأعلى معدلات الامان عبر الانترنت من خلال خدمة الكود الامن .\n\nمقبولة في عمليات الشراء من المتاجر و السحب النقدي.\n\nتمنحك إمكانية الاستمتاع بخدمة الإنترنت البنكي.\n\nتمنحك إمكانية الاستمتاع بخدمات محفظة الهاتف المحمول لدفع فواتيرك وشحن رصيد موبايلك وغيرهم من الخدمات.\n\nالاستفادة من المعاملات اللاتلامسية للحفاظ علي سلامتك.\n\nاذا فقدت البطاقة او سرقت فانه يمكنك الحفاظ علي اموالك بسهولة من خلال طلب ايقافها و طلب بطاقة بديلة في الحال.\n\nمتابعة كافة استخدامات البطاقة واستقبال الحوالات على تليفونك المحمول من خلال خدمة الرسائل النصية المجانية .\n\nالاصدار و الاستلام الفوري للبطاقة دون الحاجه الى الانتظار لعدة ايام.\n\nتصدر للعملاء بدءا من سن 15 عام.\n\nلا تحتاج الى فتح حساب بنكي او الى اجراءات ائتمانية.\n\nللاطلاع علي الشروط و الأحكام\n\n#ProductTypeMiddleContainer#\n\n#ProductMiddleContainer#\n\nTo compare between products press...\n\n#ProductTypeFooterContainer#\n\nالبند\n\nبطاقة المدفوعة مقدما\n\nمصاريف الاصدار\n\n50 جم\n\nالمصاريف السنوية\n\n30 جم\n\nمصاريف اصدار بدل فاقد / تالف\n\nعمولة الايداع من خلال ATM / فروع مصرفنا\n\nمجانا\n\nعمولة السحب النقدي من خلال ال ATM الخاصة بمصرفنا\n\nفيما عدا بطاقات العمالة المؤقتة 2 جم\n\nعمولة السحب النقدي من خلال ال ATM الخاصة بالبنوك المحلية\n\n5 جم\n\nعمولة الشراء من المتاجر\n\nالحد الاقصى لرصيد البطاقة\n\n200,000 جم\n\nالحد الاقصى للشراء اليومي / محليا\n\n30,000 جم\n\nالحد الاقصى للسحب النقدي اليومي\n\nالحد الاقصى للاستخدام اليومي / محليا\n\n60,000 جم\n\nالحد الاقصي للاستخدام الشهري للبطاقة\n\nالحد الأقصى اليومي والشهري للسحب النقدي دوليا\n\nغير متاح\n\nالحد الأقصى اليومي والشهري للمشتريات دوليا\n\nالمعاملات التي يتم إجراؤها خصمًا على بطاقات فيزا المدفوعة مقدمًا بغرض تحويل الأموال إلى بطاقات فيزا أخرى لذات العميل والمربوطة ببعض التطبيقات المالية، تخضع لمحددات الاستخدام الآتية:\n\nنوع البطاقة\n\nبطاقات فيزا المدفوعة مقدماً\n\nعدد الحركات اليومية\n\nقيمه الحركات اليومية\n\n20 ألف جم\n\nعدد الحركات الشهرية\n\n40\n\nقيمه الحركات الشهرية\n\n50 ألف جم\n\nهذه الصفحه غير متاحة\n\nSiteMap\n\n1187 كورنيش النيل ، برج البنك الأهلي ، بولاق ، القاهرة ، مصر\n\nمحليا: 19623 - دوليا: 0020219623 / 0020225941200\n\nاتصل بنا على الفور على الخط الساخن على مدار 24-ساعة 19623 للإبلاغ عن مشكلة أو بطاقة مفقودة\n\nCopyrights\n\nFloating Banner\n\nهذه الرسالة تحتوي على بيانات شخصية أو مالية. لذلك, لن يتم تنفيذ طلبك.\n\nبرجاء عدم الإفصاح عن بياناتك الشخصية أو المالية أثناء استخدام الخدمة.\n\nThis message contains personal or financial information.\n\nTherefore, your request cannot be processes here.\n\nPlease do not disclose your personal or financial data when using this service.\n\nConfirm\n\nبرجاء العلم أن الخدمة للاستعلام فقط عن المنتجات والخدمات المقدمة من البنك للعملاء الأفراد والشركات.\n\nمرحبا، 👋\n\nدعنا نتحدث إذا كان لديك أي أسئلة\n\n| البند | بطاقة المدفوعة مقدما |\n| --- | --- |\n| مصاريف الاصدار | 50 جم |\n| المصاريف السنوية | 30 جم |\n| مصاريف اصدار بدل فاقد / تالف | 50 جم |\n| عمولة الايداع من خلال ATM / فروع مصرفنا | مجانا |\n| عمولة السحب النقدي من خلال ال ATM الخاصة بمصرفنافيما عدا بطاقات العمالة المؤقتة 2 جم | مجانا |\n| عمولة السحب النقدي من خلال ال ATM الخاصة بالبنوك المحلية | 5 جم |\n| عمولة الشراء من المتاجر | مجانا |\n| الحد الاقصى لرصيد البطاقة | 200,000 جم |\n| الحد الاقصى للشراء اليومي / محليا | 30,000 جم |\n| الحد الاقصى للسحب النقدي اليومي | 30,000 جم |\n| الحد الاقصى للاستخدام اليومي / محليا | 60,000 جم |\n| الحد الاقصي للاستخدام الشهري للبطاقة | 200,000 جم |\n| الحد الأقصى اليومي والشهري للسحب النقدي دوليا | غير متاح |\n| الحد الأقصى اليومي والشهري للمشتريات دوليا | غير متاح |\n\n| نوع البطاقة | بطاقات فيزا المدفوعة مقدماً |\n| --- | --- |\n| عدد الحركات اليومية | 4 |\n| قيمه الحركات اليومية | 20 ألف جم |\n| عدد الحركات الشهرية | 40 |\n| قيمه الحركات الشهرية | 50 ألف جم |",
  "metadata": {
    "content_hash": "05a913b4a4aaab0f8785195a83c7a78ec9f71b7bc5360e1ab9378046d54bec1d",
    "extracted_at": "2026-07-14T08:40:52.904357+00:00",
    "has_tables": true,
    "source": "playwright_rescrape",
    "error": null
  }
}