{
  "id": "dde3d42fe331e177",
  "title": "البنك الأهلى المصرى - ماستركارد وورلد إيليت",
  "url": "https://www.nbe.com.eg/NBE/E/#/AR/ProductDetails?inParams=%7B%22CategoryID%22%3A%22CreditCardsID%22%2C%22ProductID%22%3A%22%D9%85%D8%A7%D8%B3%D8%AA%D8%B1%D9%83%D8%A7%D8%B1%D8%AF%20%D9%88%D9%88%D8%B1%D9%84%D8%AF%20%D8%A5%D9%8A%D9%84%D9%8A%D8%AA_17670%22%7D",
  "language": "ar",
  "content": "أفراد\n\nالشركات\n\nالمشروعات الصغيرة\n\nبلاتينم\n\nNab Bar Menu\n\nChange Language\n\nالوظائف\n\nSearch Bar\n\nNBE logo\n\nMega Menu\n\nالبطاقات\n\nبطاقات الإئتمان\n\nماستركارد وورلد إيليت\n\n#ProductHeaderContainer#\n\nمميزات البطاقة\n\n3,000,000\n\nجم (للمضمن)\n\n1,500,000\n\nجم (للغير مضمن)\n\nحتي 57 يوم\n\nعلى المشتريات فقط\n\n1000\n\nمجانا\n\n30,000 جم\n\nيوميا\n\nبرنامج نقاط الأهلي للمكافات\n\nالحصول على 2 نقطه لكل جنيه يتم استخدامه في المشتريات\n\nمزايا اضافية\n\nيمكنك الآن الحصول على أسورة الدفع الالكترونية التي تعد وسيلة عصرية للدفع الالكتروني اللا تلامسي\n\nيحق للبنك تعديل الحد الأقصى للمعاملات اللا تلامسية في أي وقت في الحدود المصرح بها (وفقا و تعليمات البنك المركزي المصري) وسوف يقوم البنك بإخطار حامل البطاقة بهذا التعديل بالوسيلة التي يراها مناسبة.\n\nتمتع بالاسترخاء قبل السفر بدخول مجاني غير محدود لعدد من الصالات المختارة في المطارات حول العالم، ولمزيد من التفاصيل يمكنك زيارة الموقع الالكتروني لهيئة ماستركارد او من خلال تطبيق الهاتف المحمول (MasterCard Travel Pass).\n\nمزايا لدى العديد من الفنادق الشهيرة بالإضافة الي العروض المقدمة بالنوادي الصحية ببعض الفنادق حول العالم.\n\nبالإضافة الي العديد من العروض الأخرى كمزايا التسوق و عروض لدي بعض شركات تأجير السيارات، و لمعرفة كافة العروض المقدمة:\n\nاستمتع بخصومات حصرية على تذاكر الطيران الدولية وحجوزات الفنادق عند الحجز من خلال موقع أو تطبيق Cleartrip\n\nتلزم شركة ماستركارد حاملي بطاقات ماستركارد وورلد إيليت الائتمانية الصادرة في مصر بإنفاق حد أدنى يعادل دولارًا أمريكيا بأي عملة أجنبية باستخدام بطاقاتهم بدءًا من 01/04/2025، في استخدامات دولية وذلك قبل الزيارة بـ72 ساعة على الأقل، للاستفادة من صلاحية الدخول إلى صالات المطارات لمدة ثلاثة أشهر بعد كل معاملة. للمزيد، يمكنك زيارة الموقع الإلكتروني لهيئة ماستركارد أو من خلال تطبيق الهاتف المحمول (MasterCard Travel Pass) زيارتين مجانيتين سنويًا قبل استيفاء متطلبات الانفاق.\n\nبدءًا من 01/08/2025، يسمح بدخول غير محدود لصالات الانتظار لحاملي بطاقة ماستركارد وورلد إيليت مع إمكانية اصطحاب ضيف واحد مجانًا وذلك بعد استيفاء متطلبات الإنفاق الدولي..\n\n#ProductTypeMiddleContainer#\n\n#ProductMiddleContainer#\n\nمنتجات آخرى\n\n#ProductOtherLayoutContainer#\n\nللمقارنة بين المنتجات اضغط ...\n\n#ProductTypeFooterContainer#\n\nمميزات بطاقات الائتمان\n\nالمرونة\n\nاستخدام البطاقة محليا ودوليا في المشتريات والسحب النقدى.\n\nالامان\n\nالتسوق الامن عبر الأنترنت من خلال خدمة الكود الامن للشراء ( OTP )\n\n24/7 الأهلي فون\n\nنتشرف بخدمتكم واجابة جميع استفساراتكم من خلال خدمة\nالأهلي فون 19523 محليا و 0020219523 على الصعيد الدولي\n\nهذه الصفحه غير متاحة\n\nSiteMap\n\n1187 كورنيش النيل ، برج البنك الأهلي ، بولاق ، القاهرة ، مصر\n\nمحليا: 19623 - دوليا: 0020219623 / 0020225941200\n\nاتصل بنا على الفور على الخط الساخن على مدار 24-ساعة 19623 للإبلاغ عن مشكلة أو بطاقة مفقودة\n\nCopyrights\n\nFloating Banner\n\nهذه الرسالة تحتوي على بيانات شخصية أو مالية. لذلك, لن يتم تنفيذ طلبك.\n\nبرجاء عدم الإفصاح عن بياناتك الشخصية أو المالية أثناء استخدام الخدمة.\n\nThis message contains personal or financial information.\n\nTherefore, your request cannot be processes here.\n\nPlease do not disclose your personal or financial data when using this service.\n\nConfirm\n\nبرجاء العلم أن الخدمة للاستعلام فقط عن المنتجات والخدمات المقدمة من البنك للعملاء الأفراد والشركات.\n\nمرحبا، 👋\n\nدعنا نتحدث إذا كان لديك أي أسئلة",
  "metadata": {
    "content_hash": "63615d6bb2fe2ec68a6275839e5edc73fcbb0757d6de89f66f36545de4da8b21",
    "extracted_at": "2026-07-14T08:40:27.587145+00:00",
    "has_tables": false,
    "source": "playwright_rescrape",
    "error": null
  }
}