{
  "id": "f4e5896a28b9a519",
  "title": "البنك الأهلى المصري",
  "url": "https://www.nbe.com.eg/NBE/E/#/AR/ProductDetails?inParams=%7B%22CategoryID%22%3A%22CreditCardsID%22%2C%22ProductID%22%3A%22%D9%81%D9%8A%D8%B2%D8%A7%20%D8%A7%D9%86%D9%81%D9%8A%D9%86%D9%8A%D8%AA_18703%22%7Dhttps://www.nbe.com.eg/NBE/E/#/AR/ProductCategory?inParams=%7B%22CategoryID%22%3A%22DepitCardsID%22%7D",
  "language": "ar",
  "content": "أفراد\n\nالشركات\n\nالمشروعات الصغيرة\n\nبلاتينم\n\nNab Bar Menu\n\nChange Language\n\nالوظائف\n\nSearch Bar\n\nNBE logo\n\nMega Menu\n\nCatagory landing div\n\nSiteMap\n\n1187 كورنيش النيل ، برج البنك الأهلي ، بولاق ، القاهرة ، مصر\n\nمحليا: 19623 - دوليا: 0020219623 / 0020225941200\n\nاتصل بنا على الفور على الخط الساخن على مدار 24-ساعة 19623 للإبلاغ عن مشكلة أو بطاقة مفقودة\n\nCopyrights\n\nFloating Banner\n\nهذه الرسالة تحتوي على بيانات شخصية أو مالية. لذلك, لن يتم تنفيذ طلبك.\n\nبرجاء عدم الإفصاح عن بياناتك الشخصية أو المالية أثناء استخدام الخدمة.\n\nThis message contains personal or financial information.\n\nTherefore, your request cannot be processes here.\n\nPlease do not disclose your personal or financial data when using this service.\n\nConfirm\n\nبرجاء العلم أن الخدمة للاستعلام فقط عن المنتجات والخدمات المقدمة من البنك للعملاء الأفراد والشركات.\n\nمرحبا، 👋\n\nدعنا نتحدث إذا كان لديك أي أسئلة",
  "metadata": {
    "content_hash": "a89cf1c564089db238fd0bf958e0654d148a2d8f4eba52a506c5ffe0ed97c797",
    "extracted_at": "2026-07-14T08:40:30.205757+00:00",
    "has_tables": false,
    "source": "playwright_rescrape",
    "error": null
  }
}