{
  "id": "1eafd131a5e27f1f",
  "title": "البنك الأهلى المصرى - الحسابات",
  "url": "https://www.nbe.com.eg/NBE/E/#/AR/ProductCategory?inParams=%7B%22CategoryID%22%3A%22AccountsID%22%7D",
  "language": "ar",
  "content": "أفراد\n\nالشركات\n\nالمشروعات الصغيرة\n\nبلاتينم\n\nNab Bar Menu\n\nChange Language\n\nالوظائف\n\nSearch Bar\n\nNBE logo\n\nMega Menu\n\nالحسابات\n\nCatagory landing div\n\nالحسابات الجارية\n\nإمكانية القيام بكافة المعاملات المصرفية اليومية في منتهي السهولة الآن مع الحساب الجاري من البنك الأهلي المصري.\n\nحسابات التوفير\n\nاستمتع بالحصول علي عائد مميز علي مدخراتك بدورية العائد التي تناسبك\n\nمبادرة افتح حسابك في مصر\n\n#CategoryMiddleContainer#\n\n#ProductShortLayoutContainer#\n\nاظغط للمقارنة بين المنتجات.\n\nشروط و احكام الحسابات النشطة والراكدة في ضوء التعليمات الصادرة عن البنك المركزي المصري\n\nتنويه هام:\n\nيرجي التوجه الي اقرب فرع لتحديث بياناتكم وذلك حرصاً على استمرار تقديم خدماتنا بسهوله ويسر .\n\nمدرج كافة عناوين الفروع على الرابط التالي:\n\nSiteMap\n\n1187 كورنيش النيل ، برج البنك الأهلي ، بولاق ، القاهرة ، مصر\n\nمحليا: 19623 - دوليا: 0020219623 / 0020225941200\n\nاتصل بنا على الفور على الخط الساخن على مدار 24-ساعة 19623 للإبلاغ عن مشكلة أو بطاقة مفقودة\n\nCopyrights\n\nFloating Banner\n\nهذه الرسالة تحتوي على بيانات شخصية أو مالية. لذلك, لن يتم تنفيذ طلبك.\n\nبرجاء عدم الإفصاح عن بياناتك الشخصية أو المالية أثناء استخدام الخدمة.\n\nThis message contains personal or financial information.\n\nTherefore, your request cannot be processes here.\n\nPlease do not disclose your personal or financial data when using this service.\n\nConfirm\n\nبرجاء العلم أن الخدمة للاستعلام فقط عن المنتجات والخدمات المقدمة من البنك للعملاء الأفراد والشركات.\n\nمرحبا، 👋\n\nدعنا نتحدث إذا كان لديك أي أسئلة",
  "metadata": {
    "content_hash": "6ab6f3126879d568a47387406fe5b58eb99ff16b147aa5ce03d4e7bc6e5260bd",
    "extracted_at": "2026-07-14T08:39:30.365006+00:00",
    "has_tables": false,
    "source": "playwright_rescrape",
    "error": null
  }
}