{
  "id": "190e1a66d7f08a8b",
  "title": "البنك الأهلى المصرى - الحساب الجاري",
  "url": "https://www.nbe.com.eg/NBE/E/#/AR/ProductDetails?inParams=%7B%22CategoryID%22%3A%22CurrentAccountsID%22%2C%22ProductID%22%3A%22%D8%A7%D9%84%D8%AD%D8%B3%D8%A7%D8%A8%20%D8%A7%D9%84%D8%AC%D8%A7%D8%B1%D9%8A_6202%22%7D",
  "language": "ar",
  "content": "أفراد\n\nالشركات\n\nالمشروعات الصغيرة\n\nبلاتينم\n\nNab Bar Menu\n\nChange Language\n\nالوظائف\n\nSearch Bar\n\nNBE logo\n\nMega Menu\n\nالحسابات\n\nالحسابات الجارية\n\nالحساب الجاري\n\nالحد الأدنى لفتح الحساب\n\n2500\n\nجم\n\n100\n\nدولار أمريكي\n\nمن لهم حق فتح الحساب\n\nالمميزات\n\nالاوراق المطلوبة و مميزات أخرى\n\nنسخة من بطاقة الهوية / جواز السفر\n\nتمتع بالإعفاء من مصاريف فتح الحساب والحد الأدنى لفتح الحساب عند فتح حسابك من خلال الأهلي نت/الأهلي موبايل.\n\nهذه الصفحه غير متاحة\n\nSiteMap\n\n1187 كورنيش النيل ، برج البنك الأهلي ، بولاق ، القاهرة ، مصر\n\nمحليا: 19623 - دوليا: 0020219623 / 0020225941200\n\nاتصل بنا على الفور على الخط الساخن على مدار 24-ساعة 19623 للإبلاغ عن مشكلة أو بطاقة مفقودة\n\nCopyrights\n\nFloating Banner\n\nهذه الرسالة تحتوي على بيانات شخصية أو مالية. لذلك, لن يتم تنفيذ طلبك.\n\nبرجاء عدم الإفصاح عن بياناتك الشخصية أو المالية أثناء استخدام الخدمة.\n\nThis message contains personal or financial information.\n\nTherefore, your request cannot be processes here.\n\nPlease do not disclose your personal or financial data when using this service.\n\nConfirm\n\nبرجاء العلم أن الخدمة للاستعلام فقط عن المنتجات والخدمات المقدمة من البنك للعملاء الأفراد والشركات.\n\nمرحبا، 👋\n\nدعنا نتحدث إذا كان لديك أي أسئلة",
  "metadata": {
    "content_hash": "d6c49fd4911df70a8caf80c1aeb405c48178770f953d1ed93847c72814a2fa13",
    "extracted_at": "2026-07-14T08:39:34.060855+00:00",
    "has_tables": false,
    "source": "playwright_rescrape",
    "error": null
  }
}