{
  "id": "4c839f7433e64bf1",
  "title": "البنك الأهلى المصرى - فيزا بلاتينم بالدولار الأمريكي",
  "url": "https://www.nbe.com.eg/NBE/E/#/AR/ProductDetails?inParams=%7B%22CategoryID%22%3A%22DepitCardsID%22%2C%22ProductID%22%3A%22%D9%81%D9%8A%D8%B2%D8%A7%20%D8%A8%D9%84%D8%A7%D8%AA%D9%8A%D9%86%D9%85%20%D8%A8%D8%A7%D9%84%D8%AF%D9%88%D9%84%D8%A7%D8%B1%20%D8%A7%D9%84%D8%A3%D9%85%D8%B1%D9%8A%D9%83%D9%8A_18811%22%7D",
  "language": "ar",
  "content": "أفراد\n\nالشركات\n\nالمشروعات الصغيرة\n\nبلاتينم\n\nNab Bar Menu\n\nChange Language\n\nالوظائف\n\nSearch Bar\n\nNBE logo\n\nMega Menu\n\nالبطاقات\n\nبطاقات الخصم المباشر\n\nفيزا بلاتينم بالدولار الأمريكي\n\n#ProductHeaderContainer#\n\nمميزات البطاقة\n\n5 سنوات\n\nدوليا\n\nمتاح\n\nالبطاقة مصممة لعملاء البنك من الأفراد الطبيعيين، أصحاب الحسابات بعملة الدولار الأمريكي.\n\nإمكانية استخدام البطاقة بالعملة الأجنبية في المشتريات لدى شبكة واسعة من التجار، والتسوق عبر الإنترنت، والسحب النقدي من ماكينات الصراف الآلي دوليًا فقط.\n\nإمكانية استخدام البطاقة من خلال ماكينات الصراف الآلي التابعة للبنك وذلك في الخدمات التالية: (تنشيط البطاقة - إنشاء رقم سري للبطاقة - الاستعلام عن رصيد الحسابات المربوطة بالبطاقة «دون إتاحة خدمة طباعة إيصال» - التحويل بين الحسابات المربوطة بالبطاقة).\n\nالإدراج التلقائي ببرنامج  Al Ahly Points الذي يتيح لكم الحصول على (20نقطة) مع كل دولار أمريكي يتم استخدامه في المشتريات.\n\nاستبدل نقاطك من خلال:\n\nاحتواء البطاقة على الخاصية اللاتلامسية الــ Contactless تتيح لكم تسوق سهل وآمن من خلال تمرير البطاقة فقط، والحد الأقصى لمبلغ العملية الواحدة التي تتم بدون إدخال الرقم السري هو (100 دولار أمريكي) أو (ما يعادله بالعملات الأجنبية) (قابلة للتعديل وفقًا لتعليمات البنك المركزي المصري).\n\nمركز اتصال مخصص لمساعدتك 24 ساعة يوميا (19523).\n\n#ProductTypeMiddleContainer#\n\n#ProductMiddleContainer#\n\nOthers Products\n\n#ProductOtherLayoutContainer#\n\nTo compare between products press...\n\n#ProductTypeFooterContainer#\n\nمميزات \nبطاقات الخصم المباشر\n\nالمرونة\n\nاستخدام البطاقة دوليا في المشتريات والسحب النقدى.\n\nالامان\n\nالتسوق الامن عبر الأنترنت من خلال خدمة الكود الامن للشراء (OTP)\n\n24/7 الأهلي فون\n\nنتشرف بخدمتكم واجابة جميع استفساراتكم من خلال خدمة\nالأهلي فون 19523 محليا و 0020225941200 دوليا\n\n#CategoryFooterContainer#\n\nهذه الصفحه غير متاحة\n\nSiteMap\n\n1187 كورنيش النيل ، برج البنك الأهلي ، بولاق ، القاهرة ، مصر\n\nمحليا: 19623 - دوليا: 0020219623 / 0020225941200\n\nاتصل بنا على الفور على الخط الساخن على مدار 24-ساعة 19623 للإبلاغ عن مشكلة أو بطاقة مفقودة\n\nCopyrights\n\nFloating Banner\n\nهذه الرسالة تحتوي على بيانات شخصية أو مالية. لذلك, لن يتم تنفيذ طلبك.\n\nبرجاء عدم الإفصاح عن بياناتك الشخصية أو المالية أثناء استخدام الخدمة.\n\nThis message contains personal or financial information.\n\nTherefore, your request cannot be processes here.\n\nPlease do not disclose your personal or financial data when using this service.\n\nConfirm\n\nبرجاء العلم أن الخدمة للاستعلام فقط عن المنتجات والخدمات المقدمة من البنك للعملاء الأفراد والشركات.\n\nمرحبا، 👋\n\nدعنا نتحدث إذا كان لديك أي أسئلة",
  "metadata": {
    "content_hash": "ecd875925cd9b64c9d7f960ab91da0585cb3c9f27aaffafd98a51e2b8f520d29",
    "extracted_at": "2026-07-14T08:40:31.213345+00:00",
    "has_tables": false,
    "source": "playwright_rescrape",
    "error": null
  }
}