{
  "id": "a390284a2e964355",
  "title": "البنك الأهلى المصرى - خدمة الـ sweeping",
  "url": "https://www.nbe.com.eg/NBE/E/#/AR/ProductDetails?inParams=%7B%22CategoryID%22%3A%22287%22%2C%22ProductID%22%3A%22%D8%AE%D8%AF%D9%85%D8%A9%20%D8%A7%D9%84%D9%80%20sweeping_18773%22%7D",
  "language": "ar",
  "content": "أفراد\n\nالشركات\n\nالمشروعات الصغيرة\n\nبلاتينم\n\nNab Bar Menu\n\nChange Language\n\nالوظائف\n\nSearch Bar\n\nNBE logo\n\nMega Menu\n\nخدمات الحسابات\n\nخدمة الـ sweeping\n\n#ProductHeaderContainer#\n\nخدمة الـتغطية التلقائية للحسابات Sweeping\n\nتقدم لك هذه الخدمة ميزة التغطية التلقائية لالتزاماتك المالية؛ ففي حال عدم كفاية الرصيد في حساب الخصم الخاص بك، يقوم النظام تلقائيًا بتحويل المبلغ المطلوب من حساباتك الأخرى بالعملة المحلية داخل البنك الأهلي المصري لتغطية هذا الالتزام فورًا.\n\nمحددات تطبيق الخدمة:\n\nالخدمة مفعّلة تلقائيًا لجميع العملاء الأفراد (الحاليين والجدد) الذين يمتلكون أكثر من حساب لدى البنك، دون الحاجة لتقديم طلب اشتراك.\n\nالخدمة مجانية.\n\nيتم تفعيل خدمة sweeping عند المطالبة بالالتزامات فقط.\n\nهذه الميزة مصممة لحمايتك وضمان استمرار معاملاتك بسلاسة، لذا فهي مفعّلة بشكل دائم وغير قابلة للإلغاء أو الإيقاف.\n\nالالتزامات التي تغطيها الخدمة (حاليًا):\n\nمستحقات بطاقتك الائتمانية.\n\nأقساط وأعباء مديونيات القروض.\n\nالشيكات المسحوبة على حسابك لدينا.\n\nالكمبيالات.\n\nالمصاريف السنوية للخزائن المؤجرة.\n\nمصاريف كشف الحسابات الدورية، والمصاريف الإدارية للحسابات.\n\nمصاريف تجديد بطاقات الخصم المباشر.\n\nخدمة التحويلات الصادرة بالعملة المحلية (ACH).\n\nحرصًا على تقديم أفضل تجربة مصرفية لك، قد نقوم مستقبلًا بإضافة التزامات جديدة لتغطيتها أو تعديل بعضها، وسنقوم بإخطارك وإطلاعك على أي تعديل في حينه.\n\nتعديل الخدمة\n\nيمكنك في أي وقت زيارة أقرب فرع لتعديل حسابك الأساسي، أو إعادة ترتيب حساباتك الأخرى التي ترغب في السحب منها لتغطية التزاماتك وفقًا لرغبتك.\n\nلن يتم تفعيل خاصية Sweeping على: -\n\nالحسابات المشتركة.\n\nالحسابات التي يديرها شخص آخر نيابة عنك (الواهب – الوصي - الولي الطبيعي – الولي الشرعي – القيم – الوكيل عن الغائب).\n\nالحسابات الإسلامية.\n\nالحسابات الجارية المدينة.\n\nالحسابات بالعملة الأجنبية.\n\nالحسابات الراكدة – حسابات المتوفيين\n\n#ProductTypeMiddleContainer#\n\n#ProductMiddleContainer#\n\nمنتجات أخري\n\n#ProductOtherLayoutContainer#\n\nللمقارنة بين المنتجات اضغط...\n\n#ProductTypeFooterContainer#\n\n#ProductFooterContainer#\n\nهذه الصفحه غير متاحة\n\nSiteMap\n\n1187 كورنيش النيل ، برج البنك الأهلي ، بولاق ، القاهرة ، مصر\n\nمحليا: 19623 - دوليا: 0020219623 / 0020225941200\n\nاتصل بنا على الفور على الخط الساخن على مدار 24-ساعة 19623 للإبلاغ عن مشكلة أو بطاقة مفقودة\n\nCopyrights\n\nFloating Banner\n\nهذه الرسالة تحتوي على بيانات شخصية أو مالية. لذلك, لن يتم تنفيذ طلبك.\n\nبرجاء عدم الإفصاح عن بياناتك الشخصية أو المالية أثناء استخدام الخدمة.\n\nThis message contains personal or financial information.\n\nTherefore, your request cannot be processes here.\n\nPlease do not disclose your personal or financial data when using this service.\n\nConfirm\n\nبرجاء العلم أن الخدمة للاستعلام فقط عن المنتجات والخدمات المقدمة من البنك للعملاء الأفراد والشركات.\n\nمرحبا، 👋\n\nدعنا نتحدث إذا كان لديك أي أسئلة",
  "metadata": {
    "content_hash": "9d99ec743f0cac189083cc45ee10b1e268d4e1d6df81c56a868d4dff05b3f21f",
    "extracted_at": "2026-07-14T08:40:01.749879+00:00",
    "has_tables": false,
    "source": "playwright_rescrape",
    "error": null
  }
}