{
  "id": "a3bafbf63660d33a",
  "title": "البنك الأهلى المصرى - خدمة الكشف الإلكتروني للحسابات",
  "url": "https://www.nbe.com.eg/NBE/E/#/AR/ProductDetails?inParams=%7B%22CategoryID%22%3A%22287%22%2C%22ProductID%22%3A%22%D8%AE%D8%AF%D9%85%D8%A9%20%D8%A7%D9%84%D9%83%D8%B4%D9%81%20%D8%A7%D9%84%D8%A5%D9%84%D9%83%D8%AA%D8%B1%D9%88%D9%86%D9%8A%20%D9%84%D9%84%D8%AD%D8%B3%D8%A7%D8%A8%D8%A7%D8%AA_18711%22%7D",
  "language": "ar",
  "content": "أفراد\n\nالشركات\n\nالمشروعات الصغيرة\n\nبلاتينم\n\nNab Bar Menu\n\nChange Language\n\nالوظائف\n\nSearch Bar\n\nNBE logo\n\nMega Menu\n\nخدمات الحسابات\n\nخدمة الكشف الإلكتروني للحسابات\n\n#ProductHeaderContainer#\n\nتعريف الخدمة:\n\nخدمة إيقاف طباعة كشوف الحسابات الورقية والاطلاع على كشف الحساب الدوري من خلال الاهلي نت / الاهلي موبايل.\n\nكيفية الاشتراك في الخدمة.\n\nالدخول على الخدمة الذاتية والاشتراك في الخدمة باستخدام الرابط التالي\n\nالفروع الالكترونية\n\nزيارة أقرب فرع من فروع مصرفنا.\n\nمركز الاتصال الهاتفي رقم 19623\n\nمزايا الخدمة:\n\nسهولة طلب الخدمة\n\nالاطلاع علي كشف حساباتك المصرفية بالإضافة إلى بيان بالشهادات، والودائع لأجل، والقروض، وصناديق الاستثمار الخاصة بكم.\n\nسهولة الاطلاع علي كشف الحساب الدوري من خلال الأهلي نت / الأهلي موبايل دون الحاجة لانتظار كشف الحساب الورقي والاحتفاظ به\n\nيتيح البنك للعميل بنهاية العام المالي \"نموذج المصادقة\" على أرصدة حسابه/حساباته رفق الكشف الإلكتروني للحساب/للحسابات ليقوم العميل بمراجعتها والتوقيع علي نموذج المصادقة بالاعتماد أو استيفاء ملاحظاته (إن وجدت) بالنموذج وإرساله على العنوانين الموضحين به.\n\nالتمتع بالأمان عند الاطلاع على كشف الحساب الدوري من خلال خدمة الاهلي نت / الاهلي موبايل باستخدام اسم المستخدم والرقم السري الخاص بكم.\n\nللاطلاع على تعريفة أسعار الخدمة برجاء الضغط على الرابط التالي\n\n#ProductTypeMiddleContainer#\n\n#ProductMiddleContainer#\n\nمنتجات أخري\n\n#ProductOtherLayoutContainer#\n\nللمقارنة بين المنتجات اضغط...\n\n#ProductTypeFooterContainer#\n\n#ProductFooterContainer#\n\nهذه الصفحه غير متاحة\n\nSiteMap\n\n1187 كورنيش النيل ، برج البنك الأهلي ، بولاق ، القاهرة ، مصر\n\nمحليا: 19623 - دوليا: 0020219623 / 0020225941200\n\nاتصل بنا على الفور على الخط الساخن على مدار 24-ساعة 19623 للإبلاغ عن مشكلة أو بطاقة مفقودة\n\nCopyrights\n\nFloating Banner\n\nهذه الرسالة تحتوي على بيانات شخصية أو مالية. لذلك, لن يتم تنفيذ طلبك.\n\nبرجاء عدم الإفصاح عن بياناتك الشخصية أو المالية أثناء استخدام الخدمة.\n\nThis message contains personal or financial information.\n\nTherefore, your request cannot be processes here.\n\nPlease do not disclose your personal or financial data when using this service.\n\nConfirm\n\nبرجاء العلم أن الخدمة للاستعلام فقط عن المنتجات والخدمات المقدمة من البنك للعملاء الأفراد والشركات.\n\nمرحبا، 👋\n\nدعنا نتحدث إذا كان لديك أي أسئلة",
  "metadata": {
    "content_hash": "1595f9da308c2ae99b2c41739e81516296fb5f45281de4f6b35c5d59d04d98a7",
    "extracted_at": "2026-07-14T08:40:01.357445+00:00",
    "has_tables": false,
    "source": "playwright_rescrape",
    "error": null
  }
}