{
  "id": "36bb2ed88dc65929",
  "title": "البنك الأهلى المصرى - حساب التوفير",
  "url": "https://www.nbe.com.eg/NBE/E/#/AR/ProductDetails?inParams=%7B%22CategoryID%22%3A%22SavingLocalAccountsID%22%2C%22ProductID%22%3A%22%D8%AD%D8%B3%D8%A7%D8%A8%20%D8%A7%D9%84%D8%AA%D9%88%D9%81%D9%8A%D8%B1_6204%22%7D",
  "language": "ar",
  "content": "أفراد\n\nالشركات\n\nالمشروعات الصغيرة\n\nبلاتينم\n\nNab Bar Menu\n\nChange Language\n\nالوظائف\n\nSearch Bar\n\nNBE logo\n\nMega Menu\n\nالحسابات\n\nحسابات التوفير\n\nحسابات التوفير - عملة محلية\n\nحساب التوفير\n\n#ProductHeaderContainer#\n\nالخصائص\n\n5,000\n\nجم\n\n10,001\n\nمصري\n\nأجنبي\n\nقاصر (باسمه تحت الولاية أو الوصاية أو الهبه).\n\nسعر العائد\n\nالشهري يصل الى\n\n11.30 %\n\nالربع سنوي يصل الى\n\n11.35 %\n\nالنصف سنوي يصل الى\n\n11.40 %\n\nالسنوي يصل الى\n\n11.50 %\n\nالأوراق المطلوبة\n\nنسخة من بطاقة الهوية / جواز السفر\n\nشهادة الميلاد للقصر\n\nمميزات أخري\n\nمرونة فى صرف العائد.\n\nالخدمات المصرفية عبرالإنترنت\n\nحساب مشترك.\n\nبطاقة خصم مباشر للسحب والشراء.\n\nتمتع بالإعفاء من مصاريف فتح الحساب والحد الأدنى لفتح الحساب عند فتح حسابك من خلال الأهلي نت/الأهلي موبايل.\n\nشرائح الرصيد/دورية العائد\n\nشهري\n\nربع سنوي\n\nنص سنوي\n\nسنوي\n\nحتى 10,000 جم\n\n0%\n\nمن 10,001 الي 100,000جم\n\n7.50%\n\n7.55%\n\n7.60%\n\n7.70%\n\nمن 100,001 الي 500,000 جم\n\n7.75%\n\n7.85%\n\n7.90%\n\n8.00%\n\nمن 500,001 الى 2,000,000 جم\n\n8.50%\n\n8.60%\n\n8.75%\n\n9%\n\nمن 2,000,001 الى 5,000,000 جم\n\n9.30%\n\n9.35%\n\n9.40%\n\n9.50%\n\nمن 5,000,001 الى 10,000,000 جم\n\n10.30%\n\n10.35%\n\n10.40%\n\n10.50%\n\nمن 10,000,001 الى 20,000,000 جم\n\n10.80%\n\n10.85%\n\n10.90%\n\n11.00%\n\nأكثر من 20 مليون جم\n\n11.30%\n\n11.35%\n\n11.40%\n\n11.50%\n\n#ProductTypeMiddleContainer#\n\n#ProductMiddleContainer#\n\nمنتجات أخري\n\nحساب توفير المدخر الصغير\n\nالحد الادني لفتح الحساب\n\n1000 جم\n\nحساب توفير المستقبل\n\nبدون حد ادني لفتح الحساب جم\n\nحساب توفير المعاش\n\n5000 جم\n\nحساب الأهلي اكسترا توفير\n\n20,000 جم\n\nللمقارنة بين المنتجات اضغط...\n\n#ProductTypeFooterContainer#\n\n#ProductFooterContainer#\n\nهذه الصفحه غير متاحة\n\nSiteMap\n\n1187 كورنيش النيل ، برج البنك الأهلي ، بولاق ، القاهرة ، مصر\n\nمحليا: 19623 - دوليا: 0020219623 / 0020225941200\n\nاتصل بنا على الفور على الخط الساخن على مدار 24-ساعة 19623 للإبلاغ عن مشكلة أو بطاقة مفقودة\n\nCopyrights\n\nFloating Banner\n\nهذه الرسالة تحتوي على بيانات شخصية أو مالية. لذلك, لن يتم تنفيذ طلبك.\n\nبرجاء عدم الإفصاح عن بياناتك الشخصية أو المالية أثناء استخدام الخدمة.\n\nThis message contains personal or financial information.\n\nTherefore, your request cannot be processes here.\n\nPlease do not disclose your personal or financial data when using this service.\n\nConfirm\n\nبرجاء العلم أن الخدمة للاستعلام فقط عن المنتجات والخدمات المقدمة من البنك للعملاء الأفراد والشركات.\n\nمرحبا، 👋\n\nدعنا نتحدث إذا كان لديك أي أسئلة\n\n| شرائح الرصيد/دورية العائد | شهري | ربع سنوي | نص سنوي | سنوي |\n| --- | --- | --- | --- | --- |\n| حتى 10,000 جم | 0% |  |  |  |\n| من 10,001 الي 100,000جم | 7.50% | 7.55% | 7.60% | 7.70% |\n| من 100,001 الي 500,000 جم | 7.75% | 7.85% | 7.90% | 8.00% |\n| من 500,001 الى 2,000,000 جم | 8.50% | 8.60% | 8.75% | 9% |\n| من 2,000,001 الى 5,000,000 جم | 9.30% | 9.35% | 9.40% | 9.50% |\n| من 5,000,001 الى 10,000,000 جم | 10.30% | 10.35% | 10.40% | 10.50% |\n| من 10,000,001 الى 20,000,000 جم | 10.80% | 10.85% | 10.90% | 11.00% |\n| أكثر من 20 مليون جم | 11.30% | 11.35% | 11.40% | 11.50% |",
  "metadata": {
    "content_hash": "0b4f53cd43127d1c0a7feb6d67ee37d169a9a757219e0eb2d53f99268decd95a",
    "extracted_at": "2026-07-14T08:39:43.498742+00:00",
    "has_tables": true,
    "source": "playwright_rescrape",
    "error": null
  }
}